-- phpMyAdmin SQL Dump
-- version 4.8.3
-- https://www.phpmyadmin.net/
--
-- Host: localhost:3306
-- Generation Time: Jan 30, 2020 at 11:50 AM
-- Server version: 5.6.41-84.1-log
-- PHP Version: 7.2.7

SET SQL_MODE = "NO_AUTO_VALUE_ON_ZERO";
SET AUTOCOMMIT = 0;
START TRANSACTION;
SET time_zone = "+00:00";


/*!40101 SET @OLD_CHARACTER_SET_CLIENT=@@CHARACTER_SET_CLIENT */;
/*!40101 SET @OLD_CHARACTER_SET_RESULTS=@@CHARACTER_SET_RESULTS */;
/*!40101 SET @OLD_COLLATION_CONNECTION=@@COLLATION_CONNECTION */;
/*!40101 SET NAMES utf8mb4 */;

--
-- Database: `tiavik_scrum`
--

-- --------------------------------------------------------

--
-- Table structure for table `admins`
--

CREATE TABLE `admins` (
  `id` bigint(20) UNSIGNED NOT NULL,
  `firstname` varchar(255) COLLATE utf8mb4_unicode_ci NOT NULL,
  `midname` varchar(255) COLLATE utf8mb4_unicode_ci NOT NULL,
  `lastname` varchar(255) COLLATE utf8mb4_unicode_ci NOT NULL,
  `email` varchar(255) COLLATE utf8mb4_unicode_ci NOT NULL,
  `address` varchar(255) COLLATE utf8mb4_unicode_ci DEFAULT NULL,
  `password` varchar(255) COLLATE utf8mb4_unicode_ci NOT NULL,
  `remember_token` varchar(100) COLLATE utf8mb4_unicode_ci DEFAULT NULL,
  `created_at` timestamp NULL DEFAULT NULL,
  `updated_at` timestamp NULL DEFAULT NULL
) ENGINE=InnoDB DEFAULT CHARSET=utf8mb4 COLLATE=utf8mb4_unicode_ci;

--
-- Dumping data for table `admins`
--

INSERT INTO `admins` (`id`, `firstname`, `midname`, `lastname`, `email`, `address`, `password`, `remember_token`, `created_at`, `updated_at`) VALUES
(1, 'Admin', 'midname', 'lastname', 'admin@app.com', NULL, '$2y$10$eFtt1Tz97Rt/vfKjSNgkPuIyJf8qO4EggUbaWUgJZY2VgOYQyb6.K', 'Kbd0C7RisQEcWAwMXN9zRsD1pNWuCb2SNMv6oH9UY97Ud206L1TMesj9xgjc', '2019-08-13 06:31:51', '2019-08-13 06:31:51');

-- --------------------------------------------------------

--
-- Table structure for table `attachments`
--

CREATE TABLE `attachments` (
  `id` int(11) NOT NULL,
  `potential_id` int(11) NOT NULL,
  `filename` varchar(255) NOT NULL,
  `created_at` timestamp NOT NULL DEFAULT CURRENT_TIMESTAMP,
  `updated_at` timestamp NOT NULL DEFAULT CURRENT_TIMESTAMP ON UPDATE CURRENT_TIMESTAMP
) ENGINE=InnoDB DEFAULT CHARSET=latin1;

-- --------------------------------------------------------

--
-- Table structure for table `attempts`
--

CREATE TABLE `attempts` (
  `id` int(11) NOT NULL,
  `user_id` int(11) NOT NULL,
  `project_id` int(11) DEFAULT NULL,
  `status` int(11) NOT NULL DEFAULT '1',
  `created_at` timestamp NOT NULL DEFAULT CURRENT_TIMESTAMP,
  `updated_at` timestamp NOT NULL DEFAULT CURRENT_TIMESTAMP ON UPDATE CURRENT_TIMESTAMP
) ENGINE=InnoDB DEFAULT CHARSET=latin1;

--
-- Dumping data for table `attempts`
--

INSERT INTO `attempts` (`id`, `user_id`, `project_id`, `status`, `created_at`, `updated_at`) VALUES
(17, 3, 15, 0, '2019-11-26 08:46:56', '2019-11-26 08:47:06'),
(18, 3, 15, 0, '2019-11-26 08:47:29', '2019-11-26 08:47:40'),
(19, 1, 2, 0, '2019-11-26 09:02:21', '2019-11-26 09:24:02'),
(20, 4, 2, 0, '2019-11-26 09:02:43', '2019-11-26 09:25:02'),
(21, 3, 15, 0, '2019-11-26 09:04:52', '2019-11-26 10:16:56'),
(22, 1, 2, 1, '2019-11-26 09:24:10', '2019-11-26 09:24:10'),
(23, 4, 2, 0, '2019-11-26 10:10:33', '2019-11-26 12:22:13'),
(24, 5, 4, 0, '2019-11-26 10:10:53', '2019-11-26 10:46:59'),
(25, 3, 15, 0, '2019-11-26 10:18:45', '2019-11-26 12:23:21'),
(26, 5, 16, 0, '2019-11-27 05:47:59', '2019-11-27 09:51:33'),
(27, 7, 4, 0, '2019-11-27 08:42:32', '2019-11-27 10:38:43'),
(28, 2, 13, 0, '2019-11-27 09:31:23', '2019-11-27 10:57:22'),
(29, 5, 4, 0, '2019-11-27 09:52:12', '2019-11-27 11:41:12'),
(30, 1, 29, 0, '2019-11-27 10:16:58', '2019-11-27 13:21:38'),
(31, 2, 2, 0, '2019-11-27 10:59:47', '2019-11-27 13:15:02'),
(32, 5, 16, 0, '2019-11-27 11:49:26', '2019-11-27 13:18:50'),
(33, 3, 1, 0, '2019-11-27 13:03:20', '2019-11-27 13:19:06'),
(34, 1, 29, 0, '2019-11-27 13:22:15', '2019-11-27 14:08:55'),
(35, 5, 16, 0, '2019-11-27 13:26:55', '2019-11-27 13:49:26'),
(36, 1, 29, 0, '2019-11-28 04:43:16', '2019-11-28 04:48:04'),
(37, 4, 2, 0, '2019-11-28 04:45:01', '2019-11-28 08:58:39'),
(38, 7, 8, 0, '2019-11-28 04:45:14', '2019-11-28 04:45:29'),
(39, 7, 4, 0, '2019-11-28 04:45:40', '2019-11-28 09:38:02'),
(40, 1, 25, 0, '2019-11-28 04:48:12', '2019-11-28 06:52:59'),
(41, 3, 15, 0, '2019-11-28 05:00:26', '2019-11-28 08:03:04'),
(42, 2, 2, 0, '2019-11-28 05:01:02', '2019-11-28 11:50:39'),
(43, 1, 29, 0, '2019-11-28 06:53:52', '2019-11-28 12:45:09'),
(44, 5, 1, 0, '2019-11-28 07:24:37', '2019-11-28 14:30:03'),
(45, 3, 15, 0, '2019-11-28 09:01:46', '2019-11-28 09:25:38'),
(46, 3, 1, 0, '2019-11-28 09:25:51', '2019-11-28 13:10:05'),
(47, 4, 3, 0, '2019-11-28 09:27:55', '2019-11-28 13:06:14'),
(48, 7, 8, 0, '2019-11-28 09:38:25', '2019-11-28 13:01:56'),
(49, 2, 2, 0, '2019-11-28 11:53:26', '2019-11-28 13:26:27'),
(50, 1, 25, 0, '2019-11-28 12:45:50', '2019-11-28 12:47:59'),
(51, 1, 29, 0, '2019-11-28 12:48:14', '2019-11-28 13:27:39'),
(52, 3, 1, 0, '2019-11-28 13:10:08', '2019-11-28 13:29:33'),
(53, 1, 25, 0, '2019-11-28 13:27:48', '2019-11-28 13:44:17'),
(54, 3, 1, 0, '2019-11-28 13:29:53', '2019-11-28 13:38:27'),
(55, 4, 3, 0, '2019-11-29 04:25:37', '2019-11-29 08:31:18'),
(56, 3, 1, 0, '2019-11-29 04:31:34', '2019-11-29 07:57:24'),
(57, 7, 7, 0, '2019-11-29 04:44:25', '2019-11-29 05:21:05'),
(58, 1, 29, 0, '2019-11-29 05:10:55', '2019-11-29 05:16:42'),
(59, 1, 1, 0, '2019-11-29 05:17:11', '2019-11-29 06:01:39'),
(60, 7, 27, 0, '2019-11-29 05:21:34', '2019-11-29 09:18:01'),
(61, 2, 13, 0, '2019-11-29 06:26:06', '2019-11-29 07:23:14'),
(62, 9, 30, 0, '2019-11-29 06:53:14', '2019-11-29 08:30:48'),
(63, 10, 6, 0, '2019-11-29 06:53:34', '2019-12-02 14:11:08'),
(64, 5, 4, 0, '2019-11-29 07:13:19', '2019-11-29 08:43:05'),
(65, 2, 2, 0, '2019-11-29 07:23:25', '2019-11-29 13:28:07'),
(66, 1, 1, 0, '2019-11-29 07:27:53', '2019-11-29 07:44:58'),
(67, 1, 29, 0, '2019-11-29 07:45:16', '2019-11-29 09:46:18'),
(68, 3, 1, 0, '2019-11-29 07:57:36', '2019-11-29 08:51:50'),
(69, 3, 1, 0, '2019-11-29 08:51:53', '2019-11-29 12:01:05'),
(70, 4, 3, 0, '2019-11-29 09:05:40', '2019-11-29 13:06:41'),
(71, 9, 30, 0, '2019-11-29 09:05:44', '2019-11-29 10:14:03'),
(72, 7, 27, 0, '2019-11-29 09:18:06', '2019-11-29 12:41:34'),
(73, 1, 2, 0, '2019-11-29 09:46:33', '2019-11-29 12:03:28'),
(74, 5, 2, 0, '2019-11-29 09:55:11', '2019-11-29 10:05:13'),
(75, 9, 7, 0, '2019-11-29 10:16:33', '2019-11-29 11:05:29'),
(76, 9, 7, 0, '2019-11-29 11:05:42', '2019-11-29 11:34:44'),
(77, 3, 21, 0, '2019-11-29 12:01:28', '2019-12-04 05:29:09'),
(78, 9, 7, 0, '2019-11-29 12:07:54', '2019-11-29 12:45:55'),
(79, 1, 25, 0, '2019-11-29 12:25:10', '2019-11-29 13:55:57'),
(80, 7, 27, 0, '2019-11-29 12:41:50', '2019-11-29 13:15:01'),
(81, 5, 2, 0, '2019-11-29 13:10:06', '2019-11-29 14:28:42'),
(82, 4, 3, 0, '2019-12-02 04:30:17', '2019-12-03 04:12:36'),
(83, 1, 25, 0, '2019-12-02 04:30:50', '2019-12-02 10:42:18'),
(84, 7, 27, 0, '2019-12-02 04:39:45', '2019-12-02 13:49:07'),
(85, 2, 2, 0, '2019-12-02 04:48:13', '2019-12-02 12:16:15'),
(86, 1, 27, 0, '2019-12-02 10:42:32', '2019-12-02 12:02:01'),
(87, 1, 25, 0, '2019-12-02 12:02:09', '2019-12-02 12:24:40'),
(88, 1, 16, 0, '2019-12-02 12:25:36', '2019-12-02 12:50:43'),
(89, 1, 25, 0, '2019-12-02 12:51:27', '2019-12-02 13:21:40'),
(90, 1, 25, 0, '2019-12-02 13:21:58', '2019-12-02 19:12:29'),
(91, 6, 4, 0, '2019-12-02 13:37:54', '2019-12-02 13:38:05'),
(92, 7, 8, 0, '2019-12-02 19:20:45', '2019-12-02 22:27:07'),
(93, 1, 25, 0, '2019-12-03 04:12:32', '2019-12-03 04:57:45'),
(94, 6, 4, 0, '2019-12-03 04:24:50', '2019-12-03 04:25:02'),
(95, 6, 6, 0, '2019-12-03 04:25:16', '2019-12-03 13:26:04'),
(96, 2, 2, 0, '2019-12-03 04:55:35', '2019-12-03 09:22:42'),
(97, 1, 16, 0, '2019-12-03 05:00:32', '2019-12-03 06:18:43'),
(98, 7, 8, 0, '2019-12-03 05:39:32', '2019-12-03 06:46:22'),
(99, 4, 3, 0, '2019-12-03 05:54:08', '2019-12-03 06:16:07'),
(100, 1, 1, 0, '2019-12-03 06:18:50', '2019-12-03 06:34:39'),
(101, 1, 16, 0, '2019-12-03 06:34:49', '2019-12-03 07:16:43'),
(102, 7, 23, 0, '2019-12-03 06:46:37', '2019-12-03 07:28:16'),
(103, 1, 25, 0, '2019-12-03 07:17:18', '2019-12-03 09:41:43'),
(104, 7, 8, 0, '2019-12-03 07:30:03', '2019-12-03 07:43:10'),
(105, 7, 31, 0, '2019-12-03 07:58:53', '2019-12-03 11:40:56'),
(106, 2, 1, 0, '2019-12-03 09:22:52', '2019-12-03 10:58:49'),
(107, 1, 1, 0, '2019-12-03 09:41:53', '2019-12-04 13:04:06'),
(108, 5, 27, 0, '2019-12-03 09:42:37', '2019-12-03 14:19:35'),
(109, 2, 2, 0, '2019-12-03 10:59:02', '2019-12-03 11:22:56'),
(110, 2, 6, 1, '2019-12-03 12:05:03', '2019-12-03 12:05:03'),
(111, 4, 3, 0, '2019-12-03 12:06:22', '2019-12-03 12:07:01'),
(112, 4, 1, 0, '2019-12-03 12:07:32', '2019-12-03 13:02:46'),
(113, 7, 31, 0, '2019-12-03 12:17:19', '2019-12-03 13:29:23'),
(114, 6, 4, 0, '2019-12-04 04:40:46', '2019-12-04 10:47:41'),
(115, 7, 27, 0, '2019-12-04 04:40:51', '2019-12-04 10:50:59'),
(116, 2, 1, 0, '2019-12-04 04:42:17', '2019-12-04 04:45:16'),
(117, 2, 13, 0, '2019-12-04 04:45:23', '2019-12-04 05:12:28'),
(118, 4, 3, 0, '2019-12-04 05:19:54', '2019-12-04 08:06:45'),
(119, 10, 6, 0, '2019-12-04 05:22:30', '2019-12-04 14:03:28'),
(120, 3, 21, 0, '2019-12-04 05:30:43', '2019-12-04 13:10:23'),
(121, 5, 31, 0, '2019-12-04 05:52:38', '2019-12-04 06:59:57'),
(122, 2, 1, 0, '2019-12-04 06:27:33', '2019-12-04 07:16:28'),
(123, 2, 2, 0, '2019-12-04 07:16:36', '2019-12-04 07:36:28'),
(124, 2, 32, 0, '2019-12-04 07:50:32', '2019-12-04 12:19:47'),
(125, 4, 1, 0, '2019-12-04 08:06:59', '2019-12-04 10:36:14'),
(126, 4, 3, 0, '2019-12-04 10:36:31', '2019-12-04 13:02:19'),
(127, 5, 8, 0, '2019-12-04 10:50:37', '2019-12-04 14:26:50'),
(128, 7, 8, 0, '2019-12-04 11:31:43', '2019-12-04 13:26:55'),
(129, 6, 4, 0, '2019-12-04 12:02:12', '2019-12-04 12:07:14'),
(130, 6, 6, 0, '2019-12-04 12:07:32', '2019-12-04 13:39:49'),
(131, 2, 32, 0, '2019-12-04 12:36:02', '2019-12-04 13:31:31'),
(132, 3, 26, 0, '2019-12-05 04:18:08', '2019-12-05 12:57:50'),
(133, 4, 3, 0, '2019-12-05 04:18:46', '2019-12-05 06:20:50'),
(134, 6, 4, 0, '2019-12-05 04:22:09', '2019-12-05 09:10:25'),
(135, 9, 33, 0, '2019-12-05 04:34:18', '2019-12-05 09:10:11'),
(136, 1, 1, 0, '2019-12-05 04:41:12', '2019-12-05 10:40:22'),
(137, 10, 6, 0, '2019-12-05 04:42:17', '2019-12-06 05:18:08'),
(138, 7, 8, 0, '2019-12-05 04:54:56', '2019-12-05 08:14:46'),
(139, 2, 32, 0, '2019-12-05 05:04:33', '2019-12-05 05:27:51'),
(140, 2, 6, 0, '2019-12-05 05:28:21', '2019-12-05 06:56:54'),
(141, 5, 31, 0, '2019-12-05 05:41:06', '2019-12-05 05:54:08'),
(142, 4, 26, 0, '2019-12-05 06:43:22', '2019-12-05 10:05:17'),
(143, 2, 32, 0, '2019-12-05 06:57:24', '2019-12-05 07:22:52'),
(144, 2, 6, 0, '2019-12-05 07:24:36', '2019-12-05 07:43:57'),
(145, 2, 32, 0, '2019-12-05 07:44:12', '2019-12-05 09:16:36'),
(146, 7, 31, 0, '2019-12-05 08:15:26', '2019-12-05 10:54:00'),
(147, 2, 6, 0, '2019-12-05 09:16:43', '2019-12-05 09:27:01'),
(148, 2, 32, 0, '2019-12-05 09:27:20', '2019-12-05 09:52:41'),
(149, 2, 26, 0, '2019-12-05 09:57:36', '2019-12-05 11:23:36'),
(150, 6, 4, 0, '2019-12-05 09:59:44', '2019-12-05 13:15:23'),
(151, 4, 3, 0, '2019-12-05 10:05:30', '2019-12-05 13:15:20'),
(152, 9, 33, 0, '2019-12-05 10:23:37', '2019-12-05 13:15:04'),
(153, 1, 22, 0, '2019-12-05 10:41:15', '2019-12-05 12:00:35'),
(154, 7, 27, 0, '2019-12-05 10:54:17', '2019-12-05 13:15:38'),
(155, 2, 26, 0, '2019-12-05 11:34:30', '2019-12-05 12:32:07'),
(156, 1, 1, 0, '2019-12-05 12:02:14', '2019-12-05 13:24:37'),
(157, 2, 2, 1, '2019-12-05 12:32:14', '2019-12-05 12:32:14'),
(158, 3, 26, 0, '2019-12-05 12:57:59', '2019-12-05 13:16:47'),
(159, 5, 31, 0, '2019-12-05 13:00:54', '2019-12-05 14:21:07'),
(160, 7, 27, 0, '2019-12-06 04:44:58', '2019-12-06 13:22:43'),
(161, 6, 4, 0, '2019-12-06 04:46:37', '2019-12-06 08:10:07'),
(162, 4, 3, 0, '2019-12-06 04:49:43', '2019-12-06 04:54:02'),
(163, 2, 32, 0, '2019-12-06 04:50:47', '2019-12-06 04:59:52'),
(164, 4, 26, 0, '2019-12-06 04:54:18', '2019-12-09 05:37:34'),
(165, 1, 1, 0, '2019-12-06 04:57:17', '2019-12-06 13:43:41'),
(166, 9, 33, 0, '2019-12-06 05:02:31', '2019-12-06 05:53:39'),
(167, 3, 23, 0, '2019-12-06 05:06:18', '2019-12-06 13:20:31'),
(168, 2, 32, 0, '2019-12-06 05:18:53', '2019-12-06 05:53:49'),
(169, 5, 31, 0, '2019-12-06 05:51:38', '2019-12-06 14:26:38'),
(170, 2, 6, 0, '2019-12-06 06:27:55', '2019-12-06 06:41:47'),
(171, 9, 33, 0, '2019-12-06 06:32:58', '2019-12-06 13:35:31'),
(172, 2, 32, 1, '2019-12-06 06:42:14', '2019-12-06 06:42:14'),
(173, 6, 4, 0, '2019-12-06 08:10:16', '2019-12-06 10:48:31'),
(174, 6, 6, 0, '2019-12-06 11:31:52', '2019-12-06 13:49:47'),
(175, 6, 6, 0, '2019-12-09 04:24:57', '2019-12-09 09:13:38'),
(176, 8, 6, 0, '2019-12-09 04:49:52', '2019-12-09 12:01:39'),
(177, 1, 1, 0, '2019-12-09 04:55:31', '2019-12-11 05:42:30'),
(178, 3, 23, 0, '2019-12-09 04:57:44', '2019-12-09 10:31:35'),
(179, 9, 33, 0, '2019-12-09 05:08:57', '2019-12-09 05:55:46'),
(180, 4, 26, 0, '2019-12-09 05:37:39', '2019-12-09 13:01:13'),
(181, 5, 31, 0, '2019-12-09 05:54:17', '2019-12-09 14:14:02'),
(182, 9, 33, 0, '2019-12-09 06:18:24', '2019-12-09 11:43:07'),
(183, 2, 6, 0, '2019-12-09 06:48:52', '2019-12-09 09:29:10'),
(184, 2, 1, 0, '2019-12-09 09:54:53', '2019-12-09 10:52:30'),
(185, 6, 4, 0, '2019-12-09 10:37:59', '2019-12-09 13:13:47'),
(186, 9, 33, 0, '2019-12-09 12:54:23', '2019-12-09 13:24:40'),
(187, 8, 6, 1, '2019-12-09 13:16:46', '2019-12-09 13:16:46'),
(188, 3, 1, 0, '2019-12-10 04:24:27', '2019-12-10 13:21:18'),
(189, 6, 4, 0, '2019-12-10 04:25:59', '2019-12-10 12:29:19'),
(190, 9, 33, 0, '2019-12-10 04:33:35', '2019-12-10 06:03:03'),
(191, 2, 2, 0, '2019-12-10 05:01:28', '2019-12-10 12:26:09'),
(192, 4, 26, 0, '2019-12-10 05:55:53', '2019-12-10 06:25:02'),
(193, 7, 27, 0, '2019-12-10 05:30:48', '2019-12-10 13:20:50'),
(194, 5, 31, 0, '2019-12-10 06:02:15', '2019-12-10 14:19:10'),
(195, 9, 33, 0, '2019-12-10 06:23:03', '2019-12-10 13:12:12'),
(196, 4, 1, 0, '2019-12-10 06:25:13', '2019-12-10 11:31:05'),
(197, 4, 26, 0, '2019-12-10 11:32:26', '2019-12-10 14:26:51'),
(198, 2, 6, 1, '2019-12-10 12:26:17', '2019-12-10 12:26:17'),
(199, 4, 26, 0, '2019-12-11 04:12:57', '2019-12-11 06:46:47'),
(200, 6, 4, 0, '2019-12-11 04:17:25', '2019-12-11 06:36:22'),
(201, 3, 23, 0, '2019-12-11 04:19:31', '2019-12-11 13:06:05'),
(202, 7, 31, 0, '2019-12-11 04:26:57', '2019-12-11 12:54:54'),
(203, 9, 33, 0, '2019-12-11 05:00:42', '2019-12-11 06:07:40'),
(204, 10, 6, 0, '2019-12-11 05:32:56', '2019-12-11 14:12:05'),
(205, 1, 1, 0, '2019-12-11 05:42:35', '2019-12-11 14:26:11'),
(206, 9, 33, 0, '2019-12-11 06:32:07', '2019-12-11 08:43:15'),
(207, 4, 1, 0, '2019-12-11 06:47:01', '2019-12-11 08:18:21'),
(208, 6, 4, 0, '2019-12-11 06:48:04', '2019-12-11 08:36:19'),
(209, 4, 26, 0, '2019-12-11 08:18:46', '2019-12-11 09:15:00'),
(210, 9, 33, 0, '2019-12-11 09:05:58', '2019-12-11 13:49:16'),
(211, 4, 26, 0, '2019-12-11 09:15:30', '2019-12-11 12:13:58'),
(212, 6, 4, 0, '2019-12-11 09:17:10', '2019-12-11 11:03:22'),
(213, 6, 4, 0, '2019-12-11 11:19:26', '2019-12-11 13:19:02'),
(214, 4, 1, 0, '2019-12-11 12:14:10', '2019-12-11 13:01:16'),
(215, 3, 23, 0, '2019-12-12 04:31:30', '2019-12-12 08:00:00'),
(216, 1, 1, 0, '2019-12-12 04:40:17', '2019-12-12 10:07:39'),
(217, 7, 8, 0, '2019-12-12 04:59:02', '2019-12-12 05:13:35'),
(218, 8, 34, 0, '2019-12-12 04:59:32', '2019-12-12 13:04:22'),
(219, 6, 4, 0, '2019-12-12 05:00:33', '2019-12-12 08:30:35'),
(220, 2, 2, 0, '2019-12-12 05:10:53', '2019-12-12 06:02:39'),
(221, 4, 26, 0, '2019-12-12 05:12:01', '2019-12-12 05:39:48'),
(222, 9, 33, 0, '2019-12-12 05:13:43', '2019-12-12 06:02:28'),
(223, 7, 31, 0, '2019-12-12 05:14:00', '2019-12-12 13:44:55'),
(224, 4, 1, 0, '2019-12-12 05:40:30', '2019-12-12 06:35:19'),
(225, 9, 33, 0, '2019-12-12 06:24:05', '2019-12-12 08:29:54'),
(226, 2, 2, 0, '2019-12-12 06:38:10', '2019-12-12 08:31:25'),
(227, 4, 26, 0, '2019-12-12 07:59:36', '2019-12-12 09:17:21'),
(228, 6, 8, 0, '2019-12-12 08:30:54', '2019-12-12 13:02:56'),
(229, 9, 33, 0, '2019-12-12 09:14:03', '2019-12-12 11:00:26'),
(230, 4, 1, 0, '2019-12-12 09:17:32', '2019-12-12 09:29:18'),
(231, 2, 2, 0, '2019-12-12 09:17:48', '2019-12-12 10:46:05'),
(232, 4, 26, 0, '2019-12-12 09:29:51', '2019-12-12 10:31:10'),
(233, 3, 23, 0, '2019-12-12 09:32:56', '2019-12-13 04:30:14'),
(234, 4, 24, 0, '2019-12-12 10:31:21', '2019-12-12 11:28:24'),
(235, 2, 2, 0, '2019-12-12 10:55:16', '2019-12-12 10:59:41'),
(236, 1, 2, 0, '2019-12-12 11:08:47', '2019-12-13 11:56:16'),
(237, 9, 33, 0, '2019-12-12 11:22:45', '2019-12-12 13:55:23'),
(238, 2, 2, 0, '2019-12-12 11:24:58', '2019-12-12 13:16:09'),
(239, 4, 26, 0, '2019-12-12 11:28:50', '2019-12-12 11:59:15'),
(240, 4, 24, 0, '2019-12-12 11:59:26', '2019-12-12 12:59:33'),
(241, 4, 24, 0, '2019-12-13 04:21:10', '2019-12-13 05:44:34'),
(242, 3, 23, 0, '2019-12-13 04:30:18', '2019-12-13 13:26:22'),
(243, 7, 31, 0, '2019-12-13 04:39:42', '2019-12-13 05:01:33'),
(244, 9, 33, 0, '2019-12-13 04:48:48', '2019-12-13 06:02:51'),
(245, 2, 2, 0, '2019-12-13 04:49:55', '2019-12-13 06:01:38'),
(246, 8, 34, 0, '2019-12-13 04:59:31', '2019-12-13 11:58:59'),
(247, 6, 4, 0, '2019-12-13 04:59:58', '2019-12-13 11:58:34'),
(248, 7, 31, 0, '2019-12-13 05:48:33', '2019-12-13 06:23:20'),
(249, 9, 33, 0, '2019-12-13 06:19:50', '2019-12-13 09:05:20'),
(250, 4, 26, 0, '2019-12-13 06:20:37', '2019-12-13 06:29:20'),
(251, 4, 2, 0, '2019-12-13 06:29:29', '2019-12-13 06:51:37'),
(252, 7, 31, 0, '2019-12-13 06:38:38', '2019-12-13 08:22:01'),
(253, 4, 13, 0, '2019-12-13 06:53:26', '2019-12-13 07:52:19'),
(254, 2, 2, 0, '2019-12-13 07:27:19', '2019-12-13 09:04:30'),
(255, 4, 26, 0, '2019-12-13 07:52:40', '2019-12-13 09:35:50'),
(256, 9, 33, 0, '2019-12-13 09:05:35', '2019-12-13 09:16:05'),
(257, 2, 2, 0, '2019-12-13 09:06:29', '2019-12-13 10:58:13'),
(258, 7, 31, 0, '2019-12-13 09:09:08', '2019-12-13 09:54:12'),
(259, 9, 6, 0, '2019-12-13 09:16:35', '2019-12-13 12:45:46'),
(260, 4, 13, 0, '2019-12-13 09:36:00', '2019-12-13 09:48:27'),
(261, 4, 26, 0, '2019-12-13 09:49:17', '2019-12-13 10:57:45'),
(262, 7, 31, 0, '2019-12-13 09:54:14', '2019-12-13 11:58:24'),
(263, 2, 2, 0, '2019-12-13 11:06:04', '2019-12-16 05:06:02'),
(264, 4, 26, 0, '2019-12-13 11:17:23', '2019-12-13 11:41:41'),
(265, 4, 13, 0, '2019-12-13 11:41:50', '2019-12-13 11:55:56'),
(266, 4, 19, 1, '2019-12-13 11:56:19', '2019-12-13 11:56:19'),
(267, 1, 24, 0, '2019-12-13 11:56:35', '2019-12-13 11:57:41'),
(268, 8, 34, 0, '2019-12-13 12:45:26', '2019-12-13 13:54:07'),
(269, 7, 31, 0, '2019-12-13 12:49:42', '2019-12-13 13:11:37'),
(270, 7, 31, 0, '2019-12-13 13:18:13', '2019-12-13 13:19:23'),
(271, 4, 13, 0, '2019-12-16 04:22:59', '2019-12-16 17:15:05'),
(272, 1, 2, 0, '2019-12-16 04:35:34', '2019-12-16 13:45:03'),
(273, 8, 34, 0, '2019-12-16 04:47:12', '2019-12-16 13:48:12'),
(274, 6, 4, 0, '2019-12-16 04:59:01', '2019-12-16 12:01:03'),
(275, 2, 2, 0, '2019-12-16 05:06:26', '2019-12-16 13:33:19'),
(276, 9, 33, 0, '2019-12-16 05:55:17', '2019-12-16 06:37:19'),
(277, 9, 6, 0, '2019-12-16 06:37:49', '2019-12-16 14:03:54'),
(278, 10, 6, 0, '2019-12-16 06:51:01', '2019-12-17 05:19:29'),
(279, 6, 8, 0, '2019-12-16 12:01:15', '2019-12-16 12:37:35'),
(280, 6, 4, 0, '2019-12-16 12:42:03', '2019-12-16 12:55:51'),
(281, 4, 13, 0, '2019-12-17 04:25:49', '2019-12-17 14:27:54'),
(282, 6, 8, 0, '2019-12-17 04:28:35', '2019-12-17 08:04:31'),
(283, 10, 6, 0, '2019-12-17 05:19:34', '2019-12-17 13:39:43'),
(284, 8, 34, 0, '2019-12-17 05:38:46', '2019-12-17 13:53:14'),
(285, 1, 2, 0, '2019-12-17 05:41:39', '2019-12-17 09:23:59'),
(286, 9, 6, 0, '2019-12-17 06:32:19', '2019-12-17 09:10:02'),
(287, 2, 2, 0, '2019-12-17 07:23:36', '2019-12-17 11:50:16'),
(288, 1, 1, 0, '2019-12-17 09:24:59', '2019-12-17 14:27:19'),
(289, 6, 4, 0, '2019-12-17 09:28:22', '2019-12-17 13:30:15'),
(290, 6, 4, 0, '2019-12-18 05:00:55', '2019-12-18 13:06:11'),
(291, 2, 28, 0, '2019-12-18 05:05:43', '2019-12-18 05:58:16'),
(292, 4, 13, 0, '2019-12-18 05:13:53', '2019-12-18 06:29:48'),
(293, 1, 1, 0, '2019-12-18 05:25:33', '2019-12-18 14:33:00'),
(294, 8, 34, 0, '2019-12-18 05:26:12', '2019-12-18 14:39:53'),
(295, 9, 6, 0, '2019-12-18 05:35:50', '2019-12-18 13:51:06'),
(296, 2, 28, 0, '2019-12-18 06:20:35', '2019-12-18 08:31:19'),
(297, 4, 8, 0, '2019-12-18 06:30:05', '2019-12-18 12:27:39'),
(298, 2, 28, 0, '2019-12-18 09:12:59', '2019-12-18 11:00:23'),
(299, 2, 28, 0, '2019-12-18 11:46:22', '2019-12-18 13:17:00'),
(300, 4, 2, 0, '2019-12-18 12:28:09', '2019-12-18 13:08:04'),
(301, 2, 28, 0, '2019-12-19 05:26:28', '2019-12-19 06:31:17'),
(302, 10, 6, 0, '2019-12-19 05:29:56', '2019-12-19 14:43:43'),
(303, 1, 1, 0, '2019-12-19 05:34:26', '2019-12-19 10:48:17'),
(304, 8, 34, 0, '2019-12-19 06:52:05', '2019-12-20 05:39:30'),
(305, 9, 6, 0, '2019-12-19 08:27:53', '2019-12-19 13:10:39'),
(306, 4, 28, 0, '2019-12-19 10:41:34', '2019-12-20 04:49:36'),
(307, 1, 13, 0, '2019-12-19 10:48:52', '2019-12-19 12:49:41'),
(308, 4, 28, 0, '2019-12-20 04:50:04', '2019-12-20 13:14:52'),
(309, 10, 6, 0, '2019-12-20 05:09:01', '2019-12-20 14:12:42'),
(310, 8, 34, 0, '2019-12-20 05:40:02', '2019-12-20 12:13:06'),
(311, 1, 13, 0, '2019-12-20 05:49:16', '2019-12-20 14:09:58'),
(312, 9, 6, 0, '2019-12-20 09:10:29', '2019-12-20 11:37:00'),
(313, 1, 1, 0, '2019-12-20 15:07:03', '2019-12-20 15:07:06'),
(314, 4, 28, 0, '2019-12-23 04:20:46', '2019-12-23 05:51:52'),
(315, 7, 31, 0, '2019-12-23 04:36:17', '2019-12-23 05:04:54'),
(316, 6, 6, 0, '2019-12-23 04:56:12', '2019-12-23 07:00:07'),
(317, 7, 8, 0, '2019-12-23 05:10:41', '2019-12-23 06:16:12'),
(318, 3, 23, 0, '2019-12-23 05:13:56', '2019-12-24 05:33:27'),
(319, 10, 6, 0, '2019-12-23 05:31:16', '2019-12-23 14:09:15'),
(320, 8, 34, 0, '2019-12-23 05:38:17', '2019-12-23 13:59:36'),
(321, 4, 28, 0, '2019-12-23 06:16:36', '2019-12-23 11:03:10'),
(322, 7, 31, 0, '2019-12-23 06:16:41', '2019-12-23 08:02:21'),
(323, 6, 4, 0, '2019-12-23 07:00:25', '2019-12-23 13:02:49'),
(324, 7, 20, 0, '2019-12-23 08:02:38', '2019-12-23 09:16:58'),
(325, 2, 4, 0, '2019-12-23 08:21:40', '2019-12-23 09:10:28'),
(326, 7, 31, 0, '2019-12-23 09:17:11', '2019-12-23 09:21:37'),
(327, 7, 20, 0, '2019-12-23 09:21:50', '2019-12-23 09:45:13'),
(328, 2, 4, 1, '2019-12-23 09:33:06', '2019-12-23 09:33:06'),
(329, 7, 31, 0, '2019-12-23 09:45:35', '2019-12-23 12:02:08'),
(330, 4, 24, 0, '2019-12-23 11:03:17', '2019-12-23 13:27:34'),
(331, 7, 31, 0, '2019-12-23 12:22:43', '2019-12-23 13:09:53'),
(332, 4, 28, 0, '2019-12-24 04:27:31', '2019-12-24 05:47:27'),
(333, 7, 31, 0, '2019-12-24 04:38:16', '2019-12-24 05:01:04'),
(334, 6, 4, 0, '2019-12-24 04:57:29', '2019-12-24 09:05:28'),
(335, 7, 20, 0, '2019-12-24 05:04:32', '2019-12-24 10:48:06'),
(336, 3, 23, 0, '2019-12-24 05:33:31', '2019-12-24 09:43:38'),
(337, 8, 34, 0, '2019-12-24 05:38:04', '2019-12-24 13:14:04'),
(338, 10, 6, 0, '2019-12-24 05:41:19', '2019-12-24 14:05:46'),
(339, 4, 24, 0, '2019-12-24 05:52:18', '2019-12-24 06:39:31'),
(340, 4, 26, 0, '2019-12-24 06:40:42', '2019-12-24 09:01:24'),
(341, 6, 4, 0, '2019-12-24 09:11:24', '2019-12-24 10:47:38'),
(342, 3, 27, 0, '2019-12-24 09:44:37', '2019-12-24 10:50:34'),
(343, 4, 26, 0, '2019-12-24 10:10:12', '2019-12-24 10:15:45'),
(344, 4, 26, 0, '2019-12-24 10:20:22', '2019-12-24 10:21:58'),
(345, 8, 34, 0, '2019-12-24 13:44:25', '2019-12-27 06:08:18'),
(346, 7, 31, 0, '2019-12-26 04:31:42', '2019-12-26 04:31:48'),
(347, 7, 20, 0, '2019-12-26 04:32:14', '2019-12-26 11:42:50'),
(348, 4, 26, 0, '2019-12-26 04:36:21', '2019-12-26 05:19:15'),
(349, 6, 4, 0, '2019-12-26 05:07:10', '2019-12-26 13:06:31'),
(350, 2, 13, 0, '2019-12-26 05:19:01', '2019-12-26 08:23:18'),
(351, 4, 8, 0, '2019-12-26 05:19:26', '2019-12-26 07:37:41'),
(352, 1, 24, 0, '2019-12-26 05:27:20', '2019-12-26 13:57:54'),
(353, 3, 27, 0, '2019-12-26 07:06:43', '2019-12-26 13:09:01'),
(354, 4, 26, 0, '2019-12-26 07:43:16', '2019-12-26 08:25:55'),
(355, 2, 13, 0, '2019-12-26 09:06:22', '2019-12-26 11:39:02'),
(356, 4, 26, 0, '2019-12-26 09:08:42', '2019-12-26 11:18:13'),
(357, 4, 26, 0, '2019-12-26 11:29:56', '2019-12-26 13:03:31'),
(358, 7, 20, 0, '2019-12-26 11:42:53', '2019-12-26 12:28:22'),
(359, 7, 27, 0, '2019-12-26 12:28:46', '2019-12-26 13:06:12'),
(360, 1, 24, 0, '2019-12-26 13:58:15', '2019-12-26 14:05:00'),
(361, 4, 26, 0, '2019-12-27 04:25:20', '2019-12-27 05:02:11'),
(362, 7, 20, 0, '2019-12-27 04:44:55', '2019-12-27 10:23:14'),
(363, 6, 4, 0, '2019-12-27 04:59:00', '2019-12-27 13:04:09'),
(364, 4, 8, 0, '2019-12-27 05:04:52', '2019-12-27 09:04:11'),
(365, 1, 24, 0, '2019-12-27 05:45:09', '2019-12-27 06:19:14'),
(366, 2, 2, 0, '2019-12-27 05:49:13', '2019-12-27 08:36:46'),
(367, 8, 34, 0, '2019-12-27 06:08:21', '2019-12-27 13:25:11'),
(368, 3, 27, 0, '2019-12-27 06:19:51', '2019-12-27 13:20:11'),
(369, 2, 2, 0, '2019-12-27 08:56:38', '2019-12-31 09:02:38'),
(370, 4, 26, 0, '2019-12-27 09:04:47', '2019-12-27 09:14:45'),
(371, 4, 8, 0, '2019-12-27 09:14:53', '2019-12-27 09:23:21'),
(372, 4, 26, 0, '2019-12-27 09:23:38', '2019-12-27 10:51:40'),
(373, 7, 20, 0, '2019-12-27 10:23:17', '2019-12-27 11:20:21'),
(374, 4, 26, 0, '2019-12-27 11:17:46', '2019-12-27 13:05:15'),
(375, 7, 20, 0, '2019-12-27 11:20:23', '2019-12-27 12:56:43'),
(376, 1, 28, 0, '2019-12-27 11:29:42', '2019-12-27 13:28:52'),
(377, 7, 31, 0, '2019-12-30 05:02:13', '2019-12-30 05:07:26'),
(378, 6, 4, 0, '2019-12-30 05:03:36', '2019-12-30 13:09:02'),
(379, 7, 20, 0, '2019-12-30 05:07:38', '2019-12-30 13:15:20'),
(380, 3, 27, 0, '2019-12-30 05:08:06', '2019-12-30 13:37:34'),
(381, 9, 20, 0, '2019-12-30 05:09:04', '2019-12-30 13:45:01'),
(382, 10, 6, 0, '2019-12-30 05:24:52', '2019-12-30 14:02:42'),
(383, 8, 34, 0, '2019-12-30 06:27:11', '2019-12-30 13:51:07'),
(384, 8, 34, 0, '2019-12-31 04:48:45', '2019-12-31 05:07:30'),
(385, 4, 26, 0, '2019-12-31 04:54:42', '2019-12-31 08:10:51'),
(386, 6, 4, 0, '2019-12-31 05:03:26', '2019-12-31 11:01:44'),
(387, 3, 27, 0, '2019-12-31 05:21:34', '2019-12-31 11:21:35'),
(388, 10, 6, 0, '2019-12-31 06:29:12', '2019-12-31 10:19:33'),
(389, 4, 8, 0, '2019-12-31 08:11:07', '2019-12-31 10:26:28'),
(390, 1, 1, 0, '2019-12-31 08:59:23', '2020-01-02 05:44:39'),
(391, 3, 27, 0, '2020-01-02 04:18:12', '2020-01-02 13:16:07'),
(392, 7, 20, 0, '2020-01-02 04:35:32', '2020-01-02 09:47:02'),
(393, 10, 6, 0, '2020-01-02 05:16:21', '2020-01-02 13:49:21'),
(394, 1, 1, 0, '2020-01-02 05:44:42', '2020-01-02 07:31:23'),
(395, 4, 2, 0, '2020-01-02 05:45:01', '2020-01-02 09:16:00'),
(396, 9, 6, 0, '2020-01-02 06:34:55', '2020-01-02 13:42:18'),
(397, 1, 28, 0, '2020-01-02 09:36:50', '2020-01-02 14:26:35'),
(398, 4, 2, 0, '2020-01-02 09:43:45', '2020-01-02 13:16:30'),
(399, 7, 8, 0, '2020-01-02 09:47:26', '2020-01-02 10:37:49'),
(400, 8, 34, 0, '2020-01-02 10:14:16', '2020-01-02 14:40:35'),
(401, 7, 8, 0, '2020-01-02 11:11:54', '2020-01-02 12:58:32'),
(402, 7, 8, 0, '2020-01-02 12:58:36', '2020-01-02 13:15:45'),
(403, 7, 8, 0, '2020-01-03 04:29:53', '2020-01-03 13:13:34'),
(404, 3, 27, 0, '2020-01-03 04:35:59', '2020-01-03 13:17:15'),
(405, 2, 2, 0, '2020-01-03 05:20:41', '2020-01-06 05:56:22'),
(406, 1, 28, 0, '2020-01-03 05:44:48', '2020-01-03 09:33:19'),
(407, 8, 34, 0, '2020-01-03 05:47:36', '2020-01-03 14:01:32'),
(408, 1, 1, 0, '2020-01-03 09:33:34', '2020-01-06 07:48:21'),
(409, 4, 8, 0, '2020-01-03 12:11:52', '2020-01-03 12:24:52'),
(410, 4, 8, 0, '2020-01-03 12:24:59', '2020-01-03 13:09:50'),
(411, 3, 27, 0, '2020-01-03 13:17:25', '2020-01-06 04:27:02'),
(412, 4, 8, 0, '2020-01-06 04:26:18', '2020-01-06 05:08:35'),
(413, 3, 27, 0, '2020-01-06 04:27:10', '2020-01-06 05:27:40'),
(414, 10, 6, 0, '2020-01-06 05:15:48', '2020-01-06 13:34:51'),
(415, 7, 8, 0, '2020-01-06 05:25:35', '2020-01-06 13:34:46'),
(416, 3, 23, 0, '2020-01-06 05:27:53', '2020-01-06 13:35:41'),
(417, 6, 4, 0, '2020-01-06 05:28:32', '2020-01-06 13:51:46'),
(418, 8, 34, 0, '2020-01-06 05:34:59', '2020-01-06 14:13:19'),
(419, 4, 35, 0, '2020-01-06 06:33:19', '2020-01-06 06:52:25'),
(420, 4, 2, 0, '2020-01-06 06:52:42', '2020-01-06 09:42:37'),
(421, 1, 1, 0, '2020-01-06 07:48:24', '2020-01-06 10:04:39'),
(422, 4, 8, 0, '2020-01-06 09:42:47', '2020-01-06 13:03:55'),
(423, 1, 35, 0, '2020-01-06 10:05:16', '2020-01-06 13:37:18'),
(424, 1, 2, 0, '2020-01-06 13:37:55', '2020-01-06 14:22:40'),
(425, 3, 27, 0, '2020-01-07 04:21:47', '2020-01-07 13:21:06'),
(426, 4, 2, 0, '2020-01-07 04:22:30', '2020-01-07 06:35:12'),
(427, 7, 8, 0, '2020-01-07 04:45:14', '2020-01-07 12:41:33'),
(428, 10, 6, 0, '2020-01-07 05:08:32', '2020-01-07 13:12:34'),
(429, 1, 2, 0, '2020-01-07 05:31:18', '2020-01-07 12:58:19'),
(430, 6, 4, 0, '2020-01-07 05:56:34', '2020-01-07 12:51:01'),
(431, 4, 28, 0, '2020-01-07 06:35:30', '2020-01-07 10:38:19'),
(432, 4, 19, 0, '2020-01-07 10:38:41', '2020-01-07 13:14:40'),
(433, 7, 8, 0, '2020-01-07 12:41:36', '2020-01-07 12:45:13'),
(434, 7, 8, 0, '2020-01-07 12:45:17', '2020-01-07 12:50:21'),
(435, 6, 4, 0, '2020-01-07 12:51:22', '2020-01-07 13:37:17'),
(436, 6, 4, 0, '2020-01-07 13:37:32', '2020-01-07 13:48:52'),
(437, 1, 35, 0, '2020-01-07 13:43:19', '2020-01-07 14:19:06'),
(438, 3, 23, 0, '2020-01-08 04:15:22', '2020-01-08 10:39:17'),
(439, 7, 27, 0, '2020-01-08 04:51:44', '2020-01-08 09:47:10'),
(440, 4, 28, 0, '2020-01-08 04:53:25', '2020-01-08 13:40:24'),
(441, 6, 4, 0, '2020-01-08 04:54:58', '2020-01-08 05:40:48'),
(442, 10, 6, 0, '2020-01-08 05:28:33', '2020-01-08 13:44:48'),
(443, 8, 6, 0, '2020-01-08 05:40:43', '2020-01-08 14:11:11'),
(444, 6, 6, 0, '2020-01-08 05:40:56', '2020-01-08 10:35:40'),
(445, 1, 35, 0, '2020-01-08 05:43:22', '2020-01-08 14:19:02'),
(446, 7, 20, 0, '2020-01-08 09:47:27', '2020-01-08 12:58:18'),
(447, 6, 6, 0, '2020-01-08 10:36:51', '2020-01-08 11:15:31'),
(448, 3, 27, 0, '2020-01-08 10:39:38', '2020-01-10 12:39:24'),
(449, 6, 4, 0, '2020-01-08 11:15:42', '2020-01-08 12:59:38'),
(450, 7, 20, 0, '2020-01-08 12:58:20', '2020-01-08 13:09:29'),
(451, 7, 20, 0, '2020-01-09 08:37:32', '2020-01-09 09:13:15'),
(452, 6, 4, 0, '2020-01-09 08:38:31', '2020-01-09 12:59:07'),
(453, 4, 32, 0, '2020-01-09 08:48:35', '2020-01-09 12:15:19'),
(454, 7, 4, 0, '2020-01-09 09:13:35', '2020-01-09 12:44:18'),
(455, 4, 2, 0, '2020-01-09 12:15:32', '2020-01-09 12:33:44'),
(456, 4, 2, 0, '2020-01-09 12:43:48', '2020-01-09 12:48:38'),
(457, 7, 4, 0, '2020-01-09 12:44:21', '2020-01-09 13:09:17'),
(458, 2, 1, 0, '2020-01-10 06:17:40', '2020-01-10 06:40:52'),
(459, 7, 20, 0, '2020-01-10 06:23:43', '2020-01-10 07:24:30'),
(460, 4, 8, 0, '2020-01-10 06:23:48', '2020-01-10 13:02:36'),
(461, 6, 4, 0, '2020-01-10 06:24:47', '2020-01-10 12:30:16'),
(462, 2, 32, 0, '2020-01-10 06:41:21', '2020-01-14 06:02:24'),
(463, 7, 27, 0, '2020-01-10 07:24:47', '2020-01-10 08:21:42'),
(464, 7, 20, 0, '2020-01-10 08:21:55', '2020-01-10 10:26:07'),
(465, 7, 27, 0, '2020-01-10 10:26:22', '2020-01-10 11:39:37'),
(466, 7, 20, 0, '2020-01-10 11:40:46', '2020-01-10 12:28:33'),
(467, 7, 23, 0, '2020-01-10 12:29:12', '2020-01-10 13:58:13'),
(468, 3, 27, 0, '2020-01-10 12:39:27', '2020-01-16 04:31:50'),
(469, 4, 13, 0, '2020-01-13 04:40:15', '2020-01-13 06:14:47'),
(470, 6, 6, 0, '2020-01-13 04:56:53', '2020-01-13 07:11:00'),
(471, 7, 20, 0, '2020-01-13 07:22:06', '2020-01-13 12:46:02'),
(472, 4, 1, 0, '2020-01-13 06:14:58', '2020-01-13 11:22:01'),
(473, 10, 6, 0, '2020-01-13 06:58:37', '2020-01-13 13:56:33'),
(474, 6, 32, 0, '2020-01-13 07:30:46', '2020-01-13 13:50:58'),
(475, 7, 27, 0, '2020-01-13 10:20:39', '2020-01-13 10:51:31'),
(476, 7, 20, 0, '2020-01-13 10:51:52', '2020-01-13 13:04:25'),
(477, 4, 35, 0, '2020-01-13 11:22:25', '2020-01-13 13:08:18'),
(478, 7, 27, 0, '2020-01-14 04:37:17', '2020-01-14 12:50:48'),
(479, 6, 8, 0, '2020-01-14 04:57:11', '2020-01-14 13:06:55'),
(480, 10, 6, 0, '2020-01-14 05:25:01', '2020-01-14 13:53:07'),
(481, 2, 32, 1, '2020-01-14 06:22:45', '2020-01-14 06:22:45'),
(482, 4, 35, 0, '2020-01-14 06:50:32', '2020-01-14 18:08:43'),
(483, 4, 35, 0, '2020-01-15 04:35:53', '2020-01-15 10:16:59'),
(484, 7, 27, 0, '2020-01-15 04:49:08', '2020-01-15 12:34:49'),
(485, 6, 8, 0, '2020-01-15 05:02:00', '2020-01-15 13:10:30'),
(486, 10, 6, 0, '2020-01-15 05:20:31', '2020-01-15 13:32:06'),
(487, 1, 1, 0, '2020-01-15 06:46:20', '2020-01-15 14:00:51'),
(488, 4, 1, 0, '2020-01-15 10:17:10', '2020-01-15 13:38:48'),
(489, 7, 27, 0, '2020-01-15 12:34:51', '2020-01-15 12:58:48'),
(490, 4, 1, 0, '2020-01-16 04:26:38', '2020-01-16 04:37:08'),
(491, 3, 27, 0, '2020-01-16 04:32:12', '2020-01-16 09:47:43'),
(492, 4, 35, 0, '2020-01-16 04:37:22', '2020-01-16 13:12:07'),
(493, 7, 27, 0, '2020-01-16 04:54:02', '2020-01-16 12:48:45'),
(494, 6, 8, 0, '2020-01-16 04:54:02', '2020-01-16 13:00:05'),
(495, 9, 20, 1, '2020-01-16 04:55:32', '2020-01-16 04:55:32'),
(496, 1, 1, 0, '2020-01-16 05:50:53', '2020-01-16 14:21:29'),
(497, 3, 23, 0, '2020-01-16 09:48:50', '2020-01-16 13:07:46'),
(498, 7, 27, 0, '2020-01-16 12:48:47', '2020-01-16 13:06:39'),
(499, 3, 23, 0, '2020-01-17 04:14:56', '2020-01-17 13:08:22'),
(500, 4, 35, 0, '2020-01-17 04:19:37', '2020-01-17 13:52:37'),
(501, 6, 8, 0, '2020-01-17 04:58:53', '2020-01-17 05:52:56'),
(502, 7, 20, 0, '2020-01-17 04:59:06', '2020-01-17 05:50:20'),
(503, 8, 6, 0, '2020-01-17 05:26:54', '2020-01-17 14:09:10'),
(504, 9, 6, 1, '2020-01-17 05:27:08', '2020-01-17 05:27:08'),
(505, 10, 6, 0, '2020-01-17 05:27:42', '2020-01-17 13:42:12'),
(506, 7, 6, 0, '2020-01-17 05:52:13', '2020-01-17 07:32:57'),
(507, 6, 37, 0, '2020-01-17 05:53:02', '2020-01-17 13:04:17'),
(508, 7, 6, 0, '2020-01-17 07:33:00', '2020-01-17 07:48:27'),
(509, 7, 20, 0, '2020-01-17 07:48:50', '2020-01-17 08:15:37'),
(510, 7, 6, 0, '2020-01-17 08:15:54', '2020-01-17 09:10:26'),
(511, 7, 20, 0, '2020-01-17 09:10:43', '2020-01-17 13:11:50'),
(512, 7, 20, 0, '2020-01-20 04:38:00', '2020-01-20 12:55:28'),
(513, 6, 37, 0, '2020-01-20 05:01:31', '2020-01-20 11:48:37'),
(514, 10, 6, 0, '2020-01-20 05:22:45', '2020-01-20 14:23:37'),
(515, 8, 6, 0, '2020-01-20 05:23:34', '2020-01-20 14:00:53'),
(516, 3, 23, 0, '2020-01-20 05:52:21', '2020-01-20 13:23:12'),
(517, 4, 35, 0, '2020-01-20 07:24:29', '2020-01-20 07:25:26'),
(518, 4, 13, 0, '2020-01-20 07:25:40', '2020-01-20 11:24:34'),
(519, 2, 2, 0, '2020-01-20 10:18:16', '2020-01-20 13:22:28'),
(520, 13, 35, 0, '2020-01-20 10:53:57', '2020-01-20 14:42:54'),
(521, 4, 1, 0, '2020-01-20 11:25:52', '2020-01-20 14:15:10'),
(522, 6, 37, 0, '2020-01-20 12:01:31', '2020-01-20 13:02:57'),
(523, 6, 37, 0, '2020-01-20 13:08:35', '2020-01-20 13:37:17'),
(524, 4, 3, 0, '2020-01-21 04:32:14', '2020-01-21 10:02:42'),
(525, 7, 20, 0, '2020-01-21 04:48:10', '2020-01-21 13:03:05'),
(526, 6, 37, 0, '2020-01-21 05:08:10', '2020-01-21 13:10:26'),
(527, 8, 6, 0, '2020-01-21 05:27:51', '2020-01-21 14:02:47'),
(528, 10, 6, 0, '2020-01-21 05:29:46', '2020-01-21 13:46:00'),
(529, 13, 35, 0, '2020-01-21 06:16:46', '2020-01-21 08:00:36'),
(530, 1, 3, 0, '2020-01-21 09:46:08', '2020-01-21 12:00:13'),
(531, 4, 37, 0, '2020-01-21 10:03:05', '2020-01-21 13:10:29'),
(532, 13, 35, 0, '2020-01-21 10:40:06', '2020-01-21 13:39:00'),
(533, 4, 3, 0, '2020-01-22 04:28:42', '2020-01-22 06:36:41'),
(534, 13, 35, 0, '2020-01-22 04:51:22', '2020-01-23 04:46:10'),
(535, 7, 20, 0, '2020-01-22 04:51:23', '2020-01-22 13:00:49'),
(536, 6, 37, 0, '2020-01-22 04:51:28', '2020-01-22 12:57:43'),
(537, 8, 6, 0, '2020-01-22 05:26:23', '2020-01-22 14:07:11'),
(538, 10, 6, 0, '2020-01-22 05:30:53', '2020-01-22 14:08:17'),
(539, 3, 27, 0, '2020-01-22 06:12:17', '2020-01-22 13:07:22'),
(540, 1, 28, 0, '2020-01-22 10:32:13', '2020-01-22 13:47:53'),
(541, 4, 22, 0, '2020-01-22 11:26:11', '2020-01-22 12:33:26'),
(542, 9, 38, 0, '2020-01-22 11:39:04', '2020-01-22 13:40:09'),
(543, 4, 22, 0, '2020-01-22 12:33:31', '2020-01-22 13:05:12'),
(544, 7, 20, 0, '2020-01-23 04:44:53', '2020-01-23 11:49:53'),
(545, 13, 35, 0, '2020-01-23 05:02:01', '2020-01-23 08:39:48'),
(546, 6, 37, 0, '2020-01-23 05:05:11', '2020-01-23 13:25:48'),
(547, 10, 6, 0, '2020-01-23 05:06:50', '2020-01-23 13:15:09'),
(548, 9, 38, 0, '2020-01-23 05:08:05', '2020-01-23 05:50:35'),
(549, 9, 38, 0, '2020-01-23 06:18:09', '2020-01-23 08:09:05'),
(550, 2, 28, 0, '2020-01-23 06:31:51', '2020-01-23 08:57:45'),
(551, 3, 27, 0, '2020-01-23 06:35:52', '2020-01-23 13:26:36'),
(552, 13, 35, 0, '2020-01-23 08:40:01', '2020-01-23 13:04:03'),
(553, 9, 38, 0, '2020-01-23 08:56:13', '2020-01-23 10:58:37'),
(554, 8, 38, 0, '2020-01-23 09:13:12', '2020-01-23 14:04:32'),
(555, 9, 38, 0, '2020-01-23 11:17:52', '2020-01-23 13:36:53'),
(556, 7, 27, 0, '2020-01-23 11:50:16', '2020-01-23 12:47:52'),
(557, 7, 20, 0, '2020-01-23 12:48:44', '2020-01-23 12:51:27'),
(558, 3, 27, 0, '2020-01-24 04:21:13', '2020-01-24 13:13:39'),
(559, 4, 28, 0, '2020-01-24 04:32:37', '2020-01-24 04:46:30'),
(560, 9, 38, 0, '2020-01-24 04:38:11', '2020-01-24 06:00:15'),
(561, 4, 37, 0, '2020-01-24 04:46:53', '2020-01-24 06:34:02'),
(562, 6, 37, 0, '2020-01-24 04:47:07', '2020-01-24 13:08:43'),
(563, 7, 20, 0, '2020-01-24 04:48:29', '2020-01-24 12:58:39'),
(564, 8, 38, 0, '2020-01-24 05:16:45', '2020-01-24 14:08:24'),
(565, 10, 6, 0, '2020-01-24 05:29:34', '2020-01-24 14:11:33'),
(566, 9, 38, 0, '2020-01-24 06:18:59', '2020-01-24 08:18:52'),
(567, 13, 40, 0, '2020-01-24 06:21:08', '2020-01-24 14:16:31'),
(568, 4, 28, 0, '2020-01-24 06:34:14', '2020-01-24 11:24:27'),
(569, 9, 38, 0, '2020-01-24 13:44:16', '2020-01-24 13:44:19'),
(570, 9, 38, 0, '2020-01-24 13:46:06', '2020-01-24 13:46:11'),
(571, 7, 20, 0, '2020-01-27 04:53:27', '2020-01-27 13:05:09'),
(572, 10, 6, 0, '2020-01-27 04:59:50', '2020-01-27 13:09:21'),
(573, 4, 28, 0, '2020-01-27 05:00:16', '2020-01-27 09:10:46'),
(574, 6, 4, 0, '2020-01-27 05:03:03', '2020-01-27 10:47:50'),
(575, 9, 38, 0, '2020-01-27 05:05:14', '2020-01-27 05:58:21'),
(576, 13, 40, 0, '2020-01-27 05:11:22', '2020-01-27 05:34:42'),
(577, 3, 27, 0, '2020-01-27 05:15:47', '2020-01-27 13:15:56'),
(578, 8, 38, 0, '2020-01-27 05:15:47', '2020-01-27 06:21:27'),
(579, 13, 35, 0, '2020-01-27 05:34:53', '2020-01-27 14:44:55'),
(580, 1, 39, 0, '2020-01-27 06:30:04', '2020-01-27 11:42:41'),
(581, 8, 6, 0, '2020-01-27 06:31:17', '2020-01-27 11:29:32'),
(582, 2, 42, 0, '2020-01-27 06:53:17', '2020-01-27 12:18:32'),
(583, 9, 38, 0, '2020-01-27 08:12:30', '2020-01-27 08:15:36'),
(584, 9, 38, 0, '2020-01-27 08:52:51', '2020-01-27 13:29:48'),
(585, 4, 37, 0, '2020-01-27 09:11:37', '2020-01-27 13:13:24'),
(586, 6, 43, 0, '2020-01-27 10:48:05', '2020-01-27 12:59:46'),
(587, 4, 37, 0, '2020-01-28 04:48:45', '2020-01-28 05:55:48'),
(588, 3, 23, 0, '2020-01-28 05:02:52', '2020-01-28 13:08:14'),
(589, 13, 35, 0, '2020-01-28 05:09:47', '2020-01-28 08:36:58'),
(590, 10, 6, 0, '2020-01-28 05:23:14', '2020-01-28 14:07:12'),
(591, 2, 2, 0, '2020-01-28 05:52:27', '2020-01-28 05:56:29'),
(592, 4, 1, 0, '2020-01-28 06:17:03', '2020-01-28 06:42:36'),
(593, 4, 28, 0, '2020-01-28 06:42:50', '2020-01-28 13:14:28'),
(594, 13, 35, 0, '2020-01-28 08:37:05', '2020-01-28 14:38:42'),
(595, 7, 20, 0, '2020-01-28 05:04:02', '2020-01-28 13:22:05'),
(596, 7, 20, 0, '2020-01-28 13:14:15', '2020-01-28 13:22:38'),
(597, 3, 23, 0, '2020-01-29 04:35:06', '2020-01-29 13:04:58'),
(598, 7, 20, 0, '2020-01-29 04:52:14', '2020-01-29 09:37:49'),
(599, 13, 35, 0, '2020-01-29 04:57:57', '2020-01-29 13:58:36'),
(600, 10, 6, 0, '2020-01-29 05:08:09', '2020-01-29 13:38:06'),
(601, 4, 13, 0, '2020-01-29 05:26:34', '2020-01-29 10:05:09'),
(602, 1, 28, 0, '2020-01-29 05:29:42', '2020-01-29 12:11:58'),
(603, 8, 6, 0, '2020-01-29 05:34:06', '2020-01-29 14:13:02'),
(604, 6, 44, 0, '2020-01-29 05:59:02', '2020-01-29 17:58:19'),
(605, 7, 27, 0, '2020-01-29 09:38:07', '2020-01-29 10:31:27'),
(606, 4, 8, 0, '2020-01-29 10:05:34', '2020-01-29 11:28:57'),
(607, 7, 20, 0, '2020-01-29 10:32:56', '2020-01-29 13:13:23'),
(608, 4, 13, 0, '2020-01-29 11:29:15', '2020-01-29 13:10:15'),
(609, 1, 13, 0, '2020-01-29 12:15:35', '2020-01-29 13:13:05'),
(610, 4, 13, 0, '2020-01-30 04:46:49', '2020-01-30 10:34:01'),
(611, 7, 20, 1, '2020-01-30 04:49:10', '2020-01-30 04:49:10'),
(612, 10, 6, 1, '2020-01-30 05:28:46', '2020-01-30 05:28:46'),
(613, 6, 44, 0, '2020-01-30 05:36:01', '2020-01-30 07:58:14'),
(614, 1, 3, 0, '2020-01-30 05:56:01', '2020-01-30 08:23:33'),
(615, 6, 41, 0, '2020-01-30 07:58:50', '2020-01-30 11:30:34'),
(616, 13, 35, 1, '2020-01-30 08:41:07', '2020-01-30 08:41:07'),
(617, 4, 45, 1, '2020-01-30 11:01:54', '2020-01-30 11:01:54');

-- --------------------------------------------------------

--
-- Table structure for table `contacs`
--

CREATE TABLE `contacs` (
  `id` int(11) NOT NULL,
  `potential_id` int(11) NOT NULL,
  `name` varchar(255) DEFAULT NULL,
  `email` varchar(255) DEFAULT NULL,
  `phone` varchar(255) DEFAULT NULL,
  `chat_type` varchar(255) DEFAULT NULL,
  `chat_id` varchar(255) DEFAULT NULL,
  `location` varchar(255) DEFAULT NULL,
  `role` varchar(255) DEFAULT NULL,
  `created_at` timestamp NOT NULL DEFAULT CURRENT_TIMESTAMP,
  `updated_at` timestamp NOT NULL DEFAULT CURRENT_TIMESTAMP ON UPDATE CURRENT_TIMESTAMP
) ENGINE=InnoDB DEFAULT CHARSET=latin1;

-- --------------------------------------------------------

--
-- Table structure for table `files`
--

CREATE TABLE `files` (
  `id` int(11) NOT NULL,
  `project_id` int(11) DEFAULT NULL,
  `user_id` int(11) DEFAULT NULL,
  `filename` varchar(255) NOT NULL,
  `updated_at` timestamp NOT NULL DEFAULT CURRENT_TIMESTAMP ON UPDATE CURRENT_TIMESTAMP,
  `created_at` timestamp NOT NULL DEFAULT CURRENT_TIMESTAMP
) ENGINE=InnoDB DEFAULT CHARSET=latin1;

--
-- Dumping data for table `files`
--

INSERT INTO `files` (`id`, `project_id`, `user_id`, `filename`, `updated_at`, `created_at`) VALUES
(2, 5, NULL, 'ownermobilebrd.docx', '2019-11-01 03:01:48', '2019-11-01 03:01:48'),
(3, 5, NULL, 'uidesign.pdf', '2019-11-01 03:01:48', '2019-11-01 03:01:48'),
(4, 31, NULL, 'eformshop-new-scope-11152019-sbk.docx', '2019-12-03 07:29:25', '2019-12-03 07:29:25'),
(5, 36, NULL, 'requirements-for-ui-1-1.pdf', '2020-01-07 06:34:07', '2020-01-07 06:34:07');

-- --------------------------------------------------------

--
-- Table structure for table `notifications`
--

CREATE TABLE `notifications` (
  `id` char(36) COLLATE utf8mb4_unicode_ci NOT NULL,
  `type` varchar(255) COLLATE utf8mb4_unicode_ci NOT NULL,
  `notifiable_type` varchar(255) COLLATE utf8mb4_unicode_ci NOT NULL,
  `notifiable_id` bigint(20) UNSIGNED NOT NULL,
  `data` text COLLATE utf8mb4_unicode_ci NOT NULL,
  `read_at` timestamp NULL DEFAULT NULL,
  `created_at` timestamp NULL DEFAULT NULL,
  `updated_at` timestamp NULL DEFAULT NULL
) ENGINE=InnoDB DEFAULT CHARSET=utf8mb4 COLLATE=utf8mb4_unicode_ci;

-- --------------------------------------------------------

--
-- Table structure for table `potentials`
--

CREATE TABLE `potentials` (
  `id` int(11) NOT NULL,
  `owner` varchar(255) NOT NULL,
  `name` varchar(255) NOT NULL,
  `lead_source` varchar(255) DEFAULT NULL,
  `phone` varchar(255) DEFAULT NULL,
  `website` varchar(255) DEFAULT NULL,
  `service` varchar(255) DEFAULT NULL,
  `lead_by` varchar(255) DEFAULT NULL,
  `shift` varchar(255) DEFAULT NULL,
  `discription` text,
  `amount` varchar(255) DEFAULT NULL,
  `demo_host` text,
  `created_at` timestamp NOT NULL DEFAULT CURRENT_TIMESTAMP,
  `updated_at` timestamp NOT NULL DEFAULT CURRENT_TIMESTAMP ON UPDATE CURRENT_TIMESTAMP
) ENGINE=InnoDB DEFAULT CHARSET=latin1;

-- --------------------------------------------------------

--
-- Table structure for table `projects`
--

CREATE TABLE `projects` (
  `id` int(11) NOT NULL,
  `project_name` varchar(255) NOT NULL,
  `technology` varchar(255) NOT NULL,
  `est_hours` varchar(11) DEFAULT NULL,
  `delivery_date` varchar(255) NOT NULL,
  `git_repo` text,
  `project_manager` varchar(255) NOT NULL,
  `description` longtext,
  `start_end` varchar(255) DEFAULT NULL,
  `status` int(11) DEFAULT '1',
  `updated_at` timestamp NOT NULL DEFAULT CURRENT_TIMESTAMP ON UPDATE CURRENT_TIMESTAMP,
  `created_at` timestamp NOT NULL DEFAULT CURRENT_TIMESTAMP
) ENGINE=InnoDB DEFAULT CHARSET=latin1;

--
-- Dumping data for table `projects`
--

INSERT INTO `projects` (`id`, `project_name`, `technology`, `est_hours`, `delivery_date`, `git_repo`, `project_manager`, `description`, `start_end`, `status`, `updated_at`, `created_at`) VALUES
(1, 'MD BioCoal', 'Laravel', '0080:00', '10/29/2019', NULL, '12', '<p>category delete</p>', '10/29/2019 - 10/29/2019', 1, '2019-11-08 10:24:42', '2019-10-29 12:17:07'),
(2, 'Vipra Business', 'WordPress', '0100:00', '10/30/2019', NULL, '3', '<p>changes in vipra</p>', '10/29/2019 - 10/29/2019', 1, '2019-11-14 14:18:45', '2019-10-29 12:29:24'),
(3, 'US Immigration Plan', 'Wordpress', '0125:00', '11/11/2019', NULL, '12', '<p>Hi All,&nbsp;</p><p>This client is looking to revamp the website, we need to redesign the website, the current website is mentioned below.&nbsp;</p><p><a target=\"_blank\" rel=\"nofollow\" href=\"https://www.usimmigrationplan.com/\">https://www.usimmigrationplan.com/</a><br></p><p>Project&nbsp;Technology&nbsp;Required<br></p><p>WordPress<br></p><p>HTML&nbsp;<br></p><p><br></p><p><br></p>', '10/29/2019 - 11/08/2019', 1, '2019-11-06 09:51:59', '2019-10-29 13:50:54'),
(4, 'Bhuumi Social', 'CI, Node', '0100:00', '10/31/2019', NULL, '6', NULL, '10/31/2019 - 10/31/2019', 2, '2020-01-29 12:23:39', '2019-10-31 04:37:05'),
(5, 'Owner Restaurant', 'Android and iOS', '0036:00', '11/12/2019', NULL, '11', '<p>This is will be an app for restaurant owners. Please read project document for detailed understanding</p>', '11/01/2019 - 11/12/2019', 2, '2019-12-10 11:19:59', '2019-11-01 03:01:48'),
(6, 'Bhuumi Chat', 'Android, iOS, Node', '1420:00', '11/18/2019', NULL, '11', NULL, '11/01/2019 - 11/15/2019', 1, '2019-11-06 09:46:15', '2019-11-01 03:20:37'),
(7, 'Bhuumi Ride', 'Android, iOS, CI', '2000:00', '11/08/2019', NULL, '11', NULL, '11/01/2019 - 11/08/2019', 2, '2020-01-16 09:58:53', '2019-11-01 03:23:13'),
(8, 'Bhuumi Web', 'CI, Node', '0616:00', '11/08/2019', NULL, '12', NULL, '11/01/2019 - 11/07/2019', 1, '2019-11-13 13:14:10', '2019-11-01 03:25:45'),
(9, 'Palms Maintenance', 'Core PhP, Android, iOS', '0040:00', '11/01/2019', NULL, '12', '<p>Correct all slider image</p><p>\r\n\r\n<a target=\"_blank\" rel=\"nofollow\" href=\"http://palmsmaintenance.com/\">http://palmsmaintenance.com/</a>&nbsp;&nbsp;<br></p>', '11/01/2019 - 11/01/2019', 2, '2019-11-20 12:51:54', '2019-11-01 06:31:20'),
(10, 'NGO', 'Wordpress', '0500:00', '11/30/2019', NULL, '12', '<p>\r\n\r\n<a target=\"_blank\" rel=\"nofollow\" href=\"http://viprabusiness.co/ngo/\">http://viprabusiness.co/ngo/</a>\r\n\r\n<br></p>', '11/01/2019 - 11/30/2019', 0, '2019-12-10 11:25:16', '2019-11-01 06:34:49'),
(13, 'Jay Morley MInistries', 'WordPress', '0050:00', '11/05/2019', NULL, '12', '<p>Update Wordpress and PayPal integration</p>', '11/01/2019 - 11/04/2019', 1, '2019-12-13 06:44:31', '2019-11-01 08:12:09'),
(14, 'LomoSolution UI', 'CI', '8000:00', '11/07/2019', NULL, '12', NULL, '11/04/2019 - 11/06/2019', 0, '2019-11-22 07:00:19', '2019-11-01 09:26:42'),
(15, 'Scrum', 'PhP, Laravel', '200:00', '01/01/2020', NULL, '3', NULL, '11/01/2019 - 12/31/2019', 1, '2019-11-06 09:35:53', '2019-11-01 13:07:21'),
(16, 'Maya\'s Pizza', 'WordPress', '0041:00', '11/12/2019', NULL, '12', '<p>Url:-  &nbsp;<a target=\"_blank\" rel=\"nofollow\" href=\"http://viprabusiness.co/develop/maya_pizza\">http://viprabusiness.co/develop/maya_pizza</a>&nbsp;</p><div>Admin:- &nbsp;<a target=\"_blank\" rel=\"nofollow\" href=\"http://viprabusiness.co/develop/maya_pizza/wp-admin\">http://viprabusiness.co/develop/maya_pizza/wp-admin</a></div><div>ID&nbsp;-&nbsp;Admin</div><div>Password:- Vipr@bu$ine&amp;&amp;</div><br><p></p>', '11/04/2019 - 11/08/2019', 2, '2020-01-16 09:44:37', '2019-11-04 07:19:28'),
(17, 'Brush Creek Church', 'WordPress', '1650:00', '11/05/2019', NULL, '12', NULL, '11/04/2019 - 11/05/2019', 2, '2019-11-20 12:50:31', '2019-11-04 12:12:04'),
(18, 'Salticme Employee', 'PhP, WordPress, CI, Laravel', '0040:00', '12/01/2019', NULL, '3', NULL, '11/01/2019 - 12/01/2019', 1, '2019-11-08 10:23:14', '2019-11-06 13:18:24'),
(19, 'StarSecutech', 'WordPress', '0016:00', '11/13/2019', NULL, '12', NULL, '11/11/2019 - 11/12/2019', 1, '2019-12-12 13:01:35', '2019-11-11 07:46:55'),
(20, 'Driver Please', 'Android, iOS, CI', '0142:00', '11/22/2019', NULL, '12', NULL, '11/12/2019 - 11/21/2019', 1, '2019-11-13 10:19:58', '2019-11-12 10:58:29'),
(21, 'DDU Start Secutech', 'PHP', '0090:00', '02/05/2020', NULL, '11', NULL, '11/12/2019 - 11/12/2019', 0, '2020-01-16 09:33:46', '2019-11-12 13:20:11'),
(22, 'Smart Shape Body', 'CI', '0016:00', '11/15/2019', NULL, '12', NULL, '11/13/2019 - 11/14/2019', 1, '2020-01-22 08:25:03', '2019-11-13 10:23:54'),
(23, 'Other Work', 'NA', NULL, '11/30/2019', NULL, '12', '<p>This is only for project estimates for projects for which you dont have any item on scrum. Hours mentioned here is subjected to approval.</p>', '11/14/2019 - 11/14/2019', 1, '2019-11-14 13:05:44', '2019-11-14 10:51:29'),
(24, 'Subiyaa', 'WordPress', '0016:00', '11/18/2019', NULL, '12', NULL, '11/15/2019 - 11/18/2019', 2, '2020-01-16 09:29:32', '2019-11-15 10:19:28'),
(25, 'Amtec INC', 'CI', '0004:00', '11/19/2019', NULL, '12', NULL, '11/18/2019 - 11/19/2019', 2, '2020-01-16 09:21:45', '2019-11-18 07:16:22'),
(26, 'Genealogy', 'Laravel', '0083:00', '12/10/2019', NULL, '12', NULL, '11/21/2019 - 12/09/2019', 0, '2020-01-29 12:21:55', '2019-11-20 09:38:27'),
(27, 'Eformshop, Plansrack, Saltrac | Code Upgrade', 'PhP', '0036:00', '11/26/2019', NULL, '12', NULL, '11/21/2019 - 11/26/2019', 2, '2020-01-29 12:22:49', '2019-11-21 06:26:48'),
(28, 'Theoldswanbarracks', 'WordPress', '0050:00', '12/02/2019', NULL, '12', NULL, '11/21/2019 - 11/21/2019', 1, '2020-01-20 10:57:01', '2019-11-21 13:37:19'),
(29, 'New Choice LLC', 'WordPress', '0016:00', '11/29/2019', NULL, '12', '<p>1) Remove Shop now from Menu</p><p>2) Salon Services to be renamed to&nbsp;&nbsp;Barber/Hair Stylist Services</p><p>3) Add 2 menu items&nbsp;(1) Real Estate Services (Buy n Sell/ general contracting) (2) Paralegal services (Civil Litigation/Foreclosures)</p><p>4) There will be a listing page for Real Estate and Paralegal Services. Clicking on an item from the list will bring up a details page</p><p>5) The details page will have Image, text and Apply Now button.</p><p>6) Clicking on Apply Now will open form with \"Name, Email, Phone, message and a hidden field\"</p><p><br></p>', '11/26/2019 - 11/28/2019', 2, '2019-12-10 11:18:39', '2019-11-26 14:02:44'),
(30, 'Women Safty iOS', 'iOS', '0040:00', '12/06/2019', NULL, '11', NULL, '11/27/2019 - 12/06/2019', 2, '2019-12-10 11:18:11', '2019-11-28 12:42:04'),
(31, 'EformShop Membership', 'Laravel, Bootstrap 4', '0360:00', '02/14/2020', NULL, '12', NULL, '12/03/2019 - 02/07/2020', 1, '2019-12-03 07:28:41', '2019-12-03 07:27:53'),
(32, 'MyBook', 'Laravel', '0333:00', '01/27/2020', NULL, '12', '<p><a target=\"_blank\" rel=\"nofollow\" href=\"https://docs.google.com/document/d/1-5NRXN-Ewt60cNGz0XF23SW9Hnc-HlHvUU_TBUdS7MY/edit?ts=5de34ea5\">https://docs.google.com/document/d/1-5NRXN-Ewt60cNGz0XF23SW9Hnc-HlHvUU_TBUdS7MY/edit?ts=5de34ea5</a><br></p>', '12/04/2019 - 01/24/2020', 0, '2020-01-29 12:21:16', '2019-12-04 07:48:01'),
(33, 'MD BioCoals', 'iOS, Android', '0300:00', '02/11/2020', NULL, '11', NULL, '12/04/2019 - 12/04/2019', 1, '2019-12-10 11:17:22', '2019-12-04 13:06:09'),
(34, 'Posvo APP', 'Android', '0113:00', '01/13/2020', NULL, '11', NULL, '12/11/2019 - 12/11/2019', 0, '2020-01-29 12:20:51', '2019-12-11 06:35:39'),
(35, 'MySeat', 'Wordpress', '0060:00', '01/10/2020', NULL, '12', '<p>Utilize theme and make changes to the design according to the shared design. This will be a 1-page website.&nbsp;</p><p></p><div>Theme to be utilised</div><div><a target=\"_blank\" rel=\"nofollow\" href=\"https://theme.visualmodo.com/it/\">https://theme.visualmodo.com/it/</a></div><div><br></div><div>Invision link for design (Desktop and Mobile)</div><div><a target=\"_blank\" rel=\"nofollow\" href=\"https://projects.invisionapp.com/share/9YTUAOI5M3X#/screens\">https://projects.invisionapp.com/share/9YTUAOI5M3X#/screens</a></div><br><p></p>', '12/26/2019 - 01/09/2020', 1, '2019-12-24 12:29:02', '2019-12-24 12:28:20'),
(36, 'UW0001', 'PSD', '0008:00', '01/07/2020', NULL, '12', '<p>Prepare a psd . We are only working on timeline page.</p>', '01/07/2020 - 01/07/2020', 0, '2020-01-29 12:19:03', '2020-01-07 06:34:07'),
(37, 'Bhuumi Profile Share', 'PhP', '0064:00', '01/21/2020', NULL, '12', '<p>Change Request 1 - Colour changes and adding some additional input text.&nbsp;&nbsp;</p>', '01/16/2020 - 01/16/2020', 2, '2020-01-29 12:15:41', '2020-01-16 09:17:34'),
(38, 'UW0002', 'iOS, Android', '0240:00', '03/04/2020', NULL, '12', '<p><b></b><br></p>', '01/22/2020 - 03/03/2020', 0, '2020-01-29 12:13:33', '2020-01-22 11:32:51'),
(39, 'UW0003', 'Wordpress', '0024:00', '01/28/2020', NULL, '12', NULL, '01/22/2020 - 01/27/2020', 0, '2020-01-29 12:11:14', '2020-01-22 11:36:32'),
(40, '187designs upgradation', 'Wordpress', '0008:00', '01/24/2020', NULL, '12', NULL, '01/23/2020 - 01/24/2020', 1, '2020-01-22 15:06:53', '2020-01-22 15:04:08'),
(41, 'America Invierte | New Scope', 'PhP', '0024:00', '02/05/2020', NULL, '12', '<p></p><div>1) We would need to migrate the project from the existing server to a shared server. Jyoti will share the files and details of the new server</div><div>2) We would need to remove the existing payment gateway from the project and integrate stripe payment gateway. Please create an account on stripe and continue working once client will share his authorization token we will replace it. </div><div>3) We would need to remove the API that we have used on the home page of the project to show share market information. </div><br><p></p><p></p><div>URL - <a target=\"_blank\" rel=\"nofollow\" href=\"https://dashboard.stripe.com/login\">https://dashboard.stripe.com/login</a></div><div>ID - <a target=\"_blank\" rel=\"nofollow\">jvelazquez@americainvierte.com</a></div><div>Pass - Efikazia_2020</div><br><p></p><p><br></p>', '01/29/2020 - 02/04/2020', 1, '2020-01-29 12:10:30', '2020-01-24 06:09:36'),
(42, 'Bhuumi Landing Page 1', 'Landing Page', '0008:00', '01/27/2020', NULL, '12', NULL, '01/27/2020 - 01/27/2020', 1, '2020-01-29 12:17:44', '2020-01-27 06:31:10'),
(43, 'Bhuumi Calander', 'PHP', '0056:00', '02/04/2020', NULL, '12', NULL, '01/27/2020 - 02/04/2020', 0, '2020-01-29 12:07:11', '2020-01-27 10:45:54'),
(44, 'plansrack/EformShop Issue Fixing', 'PhP', '0008:00', '01/29/2020', NULL, '12', NULL, '01/29/2020 - 01/29/2020', 1, '2020-01-29 05:58:40', '2020-01-29 05:58:26'),
(45, 'Vipra About Us Page', 'HTML', '0008:00', '01/31/2020', NULL, '12', NULL, '01/30/2020 - 01/31/2020', 1, '2020-01-30 10:03:04', '2020-01-30 10:02:36');

-- --------------------------------------------------------

--
-- Table structure for table `project_hour`
--

CREATE TABLE `project_hour` (
  `id` int(11) NOT NULL,
  `project_id` int(11) NOT NULL,
  `user_id` int(11) NOT NULL,
  `alloted_hours` varchar(11) DEFAULT NULL,
  `spend_hours` varchar(11) DEFAULT NULL,
  `updated_at` timestamp NOT NULL DEFAULT CURRENT_TIMESTAMP,
  `created_at` timestamp NOT NULL DEFAULT CURRENT_TIMESTAMP
) ENGINE=InnoDB DEFAULT CHARSET=latin1;

--
-- Dumping data for table `project_hour`
--

INSERT INTO `project_hour` (`id`, `project_id`, `user_id`, `alloted_hours`, `spend_hours`, `updated_at`, `created_at`) VALUES
(1, 1, 1, '0010:00', NULL, '2019-11-19 12:57:59', '2019-10-29 12:17:07'),
(2, 2, 4, '0050:00', NULL, '2020-01-23 14:17:07', '2019-10-29 12:29:24'),
(3, 2, 2, '0004:00', NULL, '2020-01-23 14:17:07', '2019-10-29 12:39:03'),
(4, 1, 2, '0010:00', NULL, '2019-11-19 12:57:59', '2019-10-29 12:57:04'),
(5, 3, 1, '0040:00', NULL, '2019-11-06 09:56:33', '2019-10-29 13:50:54'),
(6, 3, 2, '0024:00', NULL, '2019-11-06 09:56:33', '2019-10-29 13:50:54'),
(7, 3, 5, '0001:00', NULL, '2019-11-06 09:56:33', '2019-10-29 14:34:23'),
(8, 4, 6, '0008:00', NULL, '2020-01-29 12:23:39', '2019-10-31 04:37:05'),
(9, 5, 11, '0017:00', NULL, '2019-12-10 11:19:59', '2019-11-01 03:07:10'),
(10, 4, 7, NULL, NULL, '2019-11-01 03:17:24', '2019-11-01 03:17:24'),
(11, 6, 6, NULL, NULL, '2019-11-01 03:20:37', '2019-11-01 03:20:37'),
(12, 6, 8, NULL, NULL, '2019-11-01 03:20:37', '2019-11-01 03:20:37'),
(13, 6, 10, NULL, NULL, '2019-11-01 03:20:37', '2019-11-01 03:20:37'),
(14, 7, 7, NULL, NULL, '2019-11-01 03:23:14', '2019-11-01 03:23:14'),
(15, 7, 8, NULL, NULL, '2019-11-01 03:23:14', '2019-11-01 03:23:14'),
(16, 7, 9, NULL, NULL, '2019-11-01 03:23:14', '2019-11-01 03:23:14'),
(17, 8, 5, '0100:00', NULL, '2019-11-13 13:14:10', '2019-11-01 03:25:45'),
(18, 8, 7, '0200:00', NULL, '2019-11-13 13:14:10', '2019-11-01 03:25:45'),
(19, 9, 5, '0020:00', NULL, '2019-11-20 12:51:54', '2019-11-01 06:31:20'),
(20, 10, 1, '0400:00', NULL, '2019-12-10 11:25:16', '2019-11-01 06:34:49'),
(21, 10, 5, '0100:00', NULL, '2019-12-10 11:25:16', '2019-11-01 06:34:49'),
(22, 3, 4, '0016:00', NULL, '2019-11-06 09:56:33', '2019-11-01 06:39:40'),
(23, 11, 2, '1', NULL, '2019-11-01 07:13:12', '2019-11-01 07:12:59'),
(24, 5, 2, '0001:00', NULL, '2019-12-10 11:19:59', '2019-11-01 07:26:09'),
(25, 12, 2, NULL, NULL, '2019-11-01 07:40:06', '2019-11-01 07:40:06'),
(26, 5, 9, '0017:00', NULL, '2019-12-10 11:19:59', '2019-11-01 07:47:30'),
(27, 13, 1, '0008:00', NULL, '2019-12-13 06:44:49', '2019-11-01 08:12:09'),
(28, 14, 3, '5000:00', NULL, '2019-11-22 07:00:19', '2019-11-01 09:26:42'),
(29, 14, 5, '0500:00', NULL, '2019-11-22 07:00:19', '2019-11-01 09:26:42'),
(30, 14, 7, '1000:00', NULL, '2019-11-22 07:00:19', '2019-11-01 09:26:42'),
(31, 2, 1, '0001:00', NULL, '2020-01-23 14:17:07', '2019-11-01 09:49:44'),
(32, 15, 3, '100:00', NULL, '2019-11-06 09:35:53', '2019-11-01 13:07:21'),
(33, 2, 5, NULL, NULL, '2019-11-01 14:07:36', '2019-11-01 14:07:36'),
(34, 16, 1, '0016:00', NULL, '2020-01-16 09:44:37', '2019-11-04 07:19:28'),
(35, 16, 2, NULL, NULL, '2019-11-04 07:19:28', '2019-11-04 07:19:28'),
(36, 16, 5, '0008:00', NULL, '2020-01-16 09:44:37', '2019-11-04 07:19:28'),
(37, 17, 1, NULL, NULL, '2019-11-04 12:12:04', '2019-11-04 12:12:04'),
(38, 13, 5, '0004:00', NULL, '2019-12-13 06:44:49', '2019-11-05 09:04:14'),
(39, 6, 2, NULL, NULL, '2019-11-05 13:34:14', '2019-11-05 13:34:14'),
(40, 1, 3, '0010:00', NULL, '2019-11-19 12:57:59', '2019-11-06 09:59:54'),
(41, 18, 3, '0040:00', NULL, '2019-11-08 10:23:14', '2019-11-06 13:18:24'),
(42, 8, 3, '0024:00', NULL, '2019-11-13 13:14:10', '2019-11-06 13:19:32'),
(43, 1, 12, '0002:00', NULL, '2019-11-19 12:57:59', '2019-11-08 10:23:48'),
(44, 4, 5, NULL, NULL, '2019-11-08 12:47:50', '2019-11-08 12:47:50'),
(45, 18, 5, NULL, NULL, '2019-11-08 12:52:53', '2019-11-08 12:52:53'),
(46, 4, 2, NULL, NULL, '2019-11-08 13:30:55', '2019-11-08 13:30:55'),
(47, 19, 4, '0010:00', NULL, '2019-12-12 13:01:35', '2019-11-11 07:46:55'),
(48, 20, 5, '0006:00', NULL, '2019-11-13 10:20:06', '2019-11-12 10:58:29'),
(49, 21, 6, NULL, NULL, '2019-11-12 13:22:00', '2019-11-12 13:22:00'),
(50, 21, 8, NULL, NULL, '2019-11-12 13:22:00', '2019-11-12 13:22:00'),
(51, 20, 7, '0056:00', NULL, '2019-11-13 10:20:06', '2019-11-12 13:22:50'),
(52, 20, 8, '0040:00', NULL, '2019-11-13 10:20:06', '2019-11-12 13:22:50'),
(53, 6, 9, NULL, NULL, '2019-11-12 13:44:58', '2019-11-12 13:44:58'),
(54, 20, 9, '0040:00', NULL, '2019-11-13 10:20:06', '2019-11-13 10:18:00'),
(55, 22, 5, '0016:00', NULL, '2020-01-22 08:25:03', '2019-11-13 10:23:54'),
(56, 8, 6, '0005:00', NULL, '2019-11-13 13:14:10', '2019-11-13 13:13:29'),
(57, 9, 9, '0008:00', NULL, '2019-11-20 12:51:54', '2019-11-13 13:17:14'),
(58, 23, 1, NULL, NULL, '2019-11-14 10:51:29', '2019-11-14 10:51:29'),
(59, 23, 3, NULL, NULL, '2019-11-14 10:51:29', '2019-11-14 10:51:29'),
(60, 23, 11, NULL, NULL, '2019-11-14 10:51:29', '2019-11-14 10:51:29'),
(61, 24, 1, '0003:00', NULL, '2020-01-16 09:29:32', '2019-11-15 10:19:28'),
(62, 24, 5, '0003:00', NULL, '2020-01-16 09:29:32', '2019-11-15 10:19:28'),
(63, 25, 1, '0004:00', NULL, '2020-01-16 09:21:45', '2019-11-18 07:16:22'),
(64, 20, 11, NULL, NULL, '2019-11-18 13:24:48', '2019-11-18 13:24:48'),
(65, 1, 4, '0005:00', NULL, '2019-11-19 12:57:59', '2019-11-19 12:57:44'),
(66, 8, 4, NULL, NULL, '2019-11-19 13:12:53', '2019-11-19 13:12:53'),
(67, 26, 3, '0056:00', NULL, '2020-01-29 12:21:55', '2019-11-20 09:38:27'),
(68, 26, 5, '0008:00', NULL, '2020-01-29 12:21:55', '2019-11-20 09:38:27'),
(69, 23, 2, NULL, NULL, '2019-11-20 12:49:37', '2019-11-20 12:49:37'),
(70, 27, 3, NULL, NULL, '2019-11-21 06:26:48', '2019-11-21 06:26:48'),
(71, 22, 4, NULL, NULL, '2019-11-21 13:11:52', '2019-11-21 13:11:52'),
(72, 28, 2, '0018:00', NULL, '2020-01-20 10:57:01', '2019-11-21 13:37:19'),
(73, 27, 1, NULL, NULL, '2019-11-22 05:47:45', '2019-11-22 05:47:45'),
(74, 27, 7, NULL, NULL, '2019-11-22 05:47:45', '2019-11-22 05:47:45'),
(75, 23, 5, NULL, NULL, '2019-11-25 14:14:00', '2019-11-25 14:14:00'),
(76, 23, 7, NULL, NULL, '2019-11-25 14:14:30', '2019-11-25 14:14:30'),
(77, 13, 2, '0004:00', NULL, '2019-12-13 06:44:49', '2019-11-26 13:29:33'),
(78, 29, 1, '0012:00', NULL, '2019-12-10 11:18:39', '2019-11-26 14:02:44'),
(79, 29, 5, '0004:00', NULL, '2019-12-10 11:18:39', '2019-11-26 14:02:44'),
(80, 1, 5, NULL, NULL, '2019-11-28 07:07:45', '2019-11-28 07:07:45'),
(81, 30, 9, NULL, NULL, '2019-11-28 12:42:04', '2019-11-28 12:42:04'),
(82, 21, 3, '0004:00', NULL, '2020-01-16 09:36:24', '2019-11-29 07:56:06'),
(83, 22, 1, NULL, NULL, '2019-12-02 06:21:15', '2019-12-02 06:21:15'),
(84, 25, 4, NULL, NULL, '2019-12-02 13:05:33', '2019-12-02 13:05:33'),
(85, 20, 2, NULL, NULL, '2019-12-02 13:23:30', '2019-12-02 13:23:30'),
(86, 31, 5, '0040:00', NULL, '2019-12-03 07:29:25', '2019-12-03 07:27:53'),
(87, 31, 7, '0320:00', NULL, '2019-12-03 07:29:25', '2019-12-03 07:27:53'),
(88, 27, 5, '0005:00', NULL, '2020-01-29 12:22:49', '2019-12-03 09:20:44'),
(89, 32, 2, '0008:00', NULL, '2020-01-29 12:21:16', '2019-12-04 07:48:01'),
(90, 33, 9, NULL, NULL, '2019-12-04 13:06:09', '2019-12-04 13:06:09'),
(91, 26, 4, NULL, NULL, '2019-12-05 06:39:52', '2019-12-05 06:39:52'),
(92, 26, 2, NULL, NULL, '2019-12-05 09:56:53', '2019-12-05 09:56:53'),
(93, 34, 8, '0113:00', NULL, '2020-01-29 12:20:51', '2019-12-11 06:35:39'),
(94, 24, 4, '0008:00', NULL, '2020-01-16 09:29:32', '2019-12-12 10:24:07'),
(95, 13, 4, '0008:00', NULL, '2019-12-13 06:44:49', '2019-12-13 06:42:23'),
(96, 28, 4, '0024:00', NULL, '2020-01-20 10:57:01', '2019-12-19 10:25:29'),
(97, 35, 4, '0024:00', NULL, '2020-01-20 10:55:48', '2019-12-24 12:28:20'),
(98, 35, 1, '0030:00', NULL, '2020-01-20 10:55:48', '2019-12-26 05:47:53'),
(99, 28, 1, NULL, NULL, '2019-12-27 11:29:01', '2019-12-27 11:29:01'),
(100, 36, 2, '0008:00', NULL, '2020-01-29 12:19:03', '2020-01-07 06:34:07'),
(101, 32, 4, '0016:00', NULL, '2020-01-29 12:21:16', '2020-01-08 19:13:50'),
(102, 32, 6, '0176:00', NULL, '2020-01-29 12:21:16', '2020-01-13 07:25:45'),
(103, 37, 6, '0048:00', NULL, '2020-01-29 12:15:41', '2020-01-16 09:18:13'),
(104, 37, 4, '0013:00', NULL, '2020-01-29 12:15:41', '2020-01-16 09:18:43'),
(105, 4, 4, NULL, NULL, '2020-01-16 13:37:28', '2020-01-16 13:37:28'),
(106, 6, 7, NULL, NULL, '2020-01-17 05:51:33', '2020-01-17 05:51:33'),
(107, 35, 13, '0004:00', NULL, '2020-01-20 10:55:48', '2020-01-20 10:50:54'),
(108, 38, 7, NULL, NULL, '2020-01-22 11:32:51', '2020-01-22 11:32:51'),
(109, 38, 8, '0030:00', NULL, '2020-01-29 12:14:16', '2020-01-22 11:32:51'),
(110, 38, 9, '0030:00', NULL, '2020-01-29 12:14:16', '2020-01-22 11:32:51'),
(111, 39, 1, NULL, NULL, '2020-01-22 11:36:32', '2020-01-22 11:36:32'),
(112, 40, 1, NULL, NULL, '2020-01-22 15:04:08', '2020-01-22 15:04:08'),
(113, 40, 4, NULL, NULL, '2020-01-22 15:04:08', '2020-01-22 15:04:08'),
(114, 40, 13, NULL, NULL, '2020-01-23 14:15:59', '2020-01-23 14:15:59'),
(115, 2, 13, NULL, NULL, '2020-01-23 14:17:00', '2020-01-23 14:17:00'),
(116, 41, 7, NULL, NULL, '2020-01-24 06:09:36', '2020-01-24 06:09:36'),
(117, 42, 2, '0004:00', NULL, '2020-01-29 12:17:58', '2020-01-27 06:31:10'),
(118, 23, 4, NULL, NULL, '2020-01-27 08:08:56', '2020-01-27 08:08:56'),
(119, 43, 6, NULL, NULL, '2020-01-27 10:45:54', '2020-01-27 10:45:54'),
(120, 44, 6, '0008:00', NULL, '2020-01-29 12:16:12', '2020-01-29 05:58:26'),
(121, 41, 6, '0024:00', NULL, '2020-01-29 12:14:39', '2020-01-29 12:07:59'),
(122, 42, 4, '0004:00', NULL, '2020-01-29 12:17:58', '2020-01-29 12:17:18'),
(123, 44, 3, NULL, NULL, '2020-01-30 08:38:58', '2020-01-30 08:38:58'),
(124, 45, 4, '0008:00', NULL, '2020-01-30 10:03:04', '2020-01-30 10:02:36');

-- --------------------------------------------------------

--
-- Table structure for table `project_user`
--

CREATE TABLE `project_user` (
  `id` int(11) NOT NULL,
  `project_id` int(11) NOT NULL,
  `user_id` int(11) NOT NULL,
  `alloted_hours` varchar(25) DEFAULT NULL,
  `updated_at` timestamp NOT NULL DEFAULT CURRENT_TIMESTAMP ON UPDATE CURRENT_TIMESTAMP,
  `created_at` timestamp NOT NULL DEFAULT CURRENT_TIMESTAMP
) ENGINE=InnoDB DEFAULT CHARSET=latin1;

--
-- Dumping data for table `project_user`
--

INSERT INTO `project_user` (`id`, `project_id`, `user_id`, `alloted_hours`, `updated_at`, `created_at`) VALUES
(1, 1, 1, NULL, '2019-10-29 12:17:07', '2019-10-29 12:17:07'),
(2, 2, 4, NULL, '2019-10-29 12:29:24', '2019-10-29 12:29:24'),
(4, 1, 2, NULL, '2019-10-29 12:57:04', '2019-10-29 12:57:04'),
(5, 3, 1, NULL, '2019-10-29 13:50:54', '2019-10-29 13:50:54'),
(6, 3, 2, NULL, '2019-10-29 13:50:54', '2019-10-29 13:50:54'),
(8, 4, 6, NULL, '2019-10-31 04:37:05', '2019-10-31 04:37:05'),
(9, 5, 11, NULL, '2019-11-01 03:07:10', '2019-11-01 03:07:10'),
(10, 4, 7, NULL, '2019-11-01 03:17:24', '2019-11-01 03:17:24'),
(11, 6, 6, NULL, '2019-11-01 03:20:37', '2019-11-01 03:20:37'),
(12, 6, 8, NULL, '2019-11-01 03:20:37', '2019-11-01 03:20:37'),
(13, 6, 10, NULL, '2019-11-01 03:20:37', '2019-11-01 03:20:37'),
(14, 7, 7, NULL, '2019-11-01 03:23:14', '2019-11-01 03:23:14'),
(15, 7, 8, NULL, '2019-11-01 03:23:14', '2019-11-01 03:23:14'),
(16, 7, 9, NULL, '2019-11-01 03:23:14', '2019-11-01 03:23:14'),
(17, 8, 5, NULL, '2019-11-01 03:25:45', '2019-11-01 03:25:45'),
(18, 8, 7, NULL, '2019-11-01 03:25:45', '2019-11-01 03:25:45'),
(19, 9, 5, NULL, '2019-11-01 06:31:20', '2019-11-01 06:31:20'),
(20, 10, 1, NULL, '2019-11-01 06:34:49', '2019-11-01 06:34:49'),
(21, 10, 5, NULL, '2019-11-01 06:34:49', '2019-11-01 06:34:49'),
(22, 3, 4, NULL, '2019-11-01 06:39:40', '2019-11-01 06:39:40'),
(23, 11, 2, NULL, '2019-11-01 07:12:59', '2019-11-01 07:12:59'),
(24, 5, 2, NULL, '2019-11-01 07:26:09', '2019-11-01 07:26:09'),
(25, 12, 2, NULL, '2019-11-01 07:40:06', '2019-11-01 07:40:06'),
(26, 5, 9, NULL, '2019-11-01 07:47:30', '2019-11-01 07:47:30'),
(27, 13, 1, NULL, '2019-11-01 08:12:09', '2019-11-01 08:12:09'),
(28, 14, 3, NULL, '2019-11-01 09:26:42', '2019-11-01 09:26:42'),
(29, 14, 5, NULL, '2019-11-01 09:26:42', '2019-11-01 09:26:42'),
(30, 14, 7, NULL, '2019-11-01 09:26:42', '2019-11-01 09:26:42'),
(31, 2, 1, NULL, '2019-11-01 09:49:44', '2019-11-01 09:49:44'),
(32, 15, 3, NULL, '2019-11-01 13:07:21', '2019-11-01 13:07:21'),
(33, 2, 5, NULL, '2019-11-01 14:07:36', '2019-11-01 14:07:36'),
(34, 16, 1, NULL, '2019-11-04 07:19:28', '2019-11-04 07:19:28'),
(35, 16, 2, NULL, '2019-11-04 07:19:28', '2019-11-04 07:19:28'),
(36, 16, 5, NULL, '2019-11-04 07:19:28', '2019-11-04 07:19:28'),
(37, 17, 1, NULL, '2019-11-04 12:12:04', '2019-11-04 12:12:04'),
(38, 13, 5, NULL, '2019-11-05 09:04:14', '2019-11-05 09:04:14'),
(39, 6, 2, NULL, '2019-11-05 13:34:14', '2019-11-05 13:34:14'),
(40, 3, 5, NULL, '2019-11-06 09:55:07', '2019-11-06 09:55:07'),
(41, 2, 2, NULL, '2019-11-06 09:58:20', '2019-11-06 09:58:20'),
(42, 1, 3, NULL, '2019-11-06 09:59:54', '2019-11-06 09:59:54'),
(43, 18, 3, NULL, '2019-11-06 13:18:24', '2019-11-06 13:18:24'),
(44, 8, 3, NULL, '2019-11-06 13:19:32', '2019-11-06 13:19:32'),
(45, 1, 12, NULL, '2019-11-08 10:23:48', '2019-11-08 10:23:48'),
(46, 4, 5, NULL, '2019-11-08 12:47:50', '2019-11-08 12:47:50'),
(47, 18, 5, NULL, '2019-11-08 12:52:53', '2019-11-08 12:52:53'),
(48, 4, 2, NULL, '2019-11-08 13:30:55', '2019-11-08 13:30:55'),
(49, 19, 4, NULL, '2019-11-11 07:46:55', '2019-11-11 07:46:55'),
(50, 20, 5, NULL, '2019-11-12 10:58:29', '2019-11-12 10:58:29'),
(51, 21, 6, NULL, '2019-11-12 13:22:00', '2019-11-12 13:22:00'),
(52, 21, 8, NULL, '2019-11-12 13:22:00', '2019-11-12 13:22:00'),
(53, 20, 7, NULL, '2019-11-12 13:22:50', '2019-11-12 13:22:50'),
(54, 20, 8, NULL, '2019-11-12 13:22:50', '2019-11-12 13:22:50'),
(55, 6, 9, NULL, '2019-11-12 13:44:58', '2019-11-12 13:44:58'),
(56, 20, 9, NULL, '2019-11-13 10:18:00', '2019-11-13 10:18:00'),
(57, 22, 5, NULL, '2019-11-13 10:23:54', '2019-11-13 10:23:54'),
(58, 8, 6, NULL, '2019-11-13 13:13:29', '2019-11-13 13:13:29'),
(59, 9, 9, NULL, '2019-11-13 13:17:14', '2019-11-13 13:17:14'),
(60, 23, 1, NULL, '2019-11-14 10:51:29', '2019-11-14 10:51:29'),
(61, 23, 3, NULL, '2019-11-14 10:51:29', '2019-11-14 10:51:29'),
(62, 23, 11, NULL, '2019-11-14 10:51:29', '2019-11-14 10:51:29'),
(63, 24, 1, NULL, '2019-11-15 10:19:28', '2019-11-15 10:19:28'),
(64, 24, 5, NULL, '2019-11-15 10:19:28', '2019-11-15 10:19:28'),
(65, 25, 1, NULL, '2019-11-18 07:16:22', '2019-11-18 07:16:22'),
(66, 20, 11, NULL, '2019-11-18 13:24:48', '2019-11-18 13:24:48'),
(67, 1, 4, NULL, '2019-11-19 12:57:44', '2019-11-19 12:57:44'),
(68, 8, 4, NULL, '2019-11-19 13:12:53', '2019-11-19 13:12:53'),
(69, 26, 3, NULL, '2019-11-20 09:38:27', '2019-11-20 09:38:27'),
(70, 26, 5, NULL, '2019-11-20 09:38:27', '2019-11-20 09:38:27'),
(71, 23, 2, NULL, '2019-11-20 12:49:37', '2019-11-20 12:49:37'),
(73, 22, 4, NULL, '2019-11-21 13:11:52', '2019-11-21 13:11:52'),
(74, 28, 2, NULL, '2019-11-21 13:37:19', '2019-11-21 13:37:19'),
(75, 27, 1, NULL, '2019-11-22 05:47:45', '2019-11-22 05:47:45'),
(76, 27, 7, NULL, '2019-11-22 05:47:45', '2019-11-22 05:47:45'),
(77, 23, 5, NULL, '2019-11-25 14:14:00', '2019-11-25 14:14:00'),
(78, 23, 7, NULL, '2019-11-25 14:14:30', '2019-11-25 14:14:30'),
(79, 13, 2, NULL, '2019-11-26 13:29:33', '2019-11-26 13:29:33'),
(80, 29, 1, NULL, '2019-11-26 14:02:44', '2019-11-26 14:02:44'),
(81, 29, 5, NULL, '2019-11-26 14:02:44', '2019-11-26 14:02:44'),
(82, 1, 5, NULL, '2019-11-28 07:07:45', '2019-11-28 07:07:45'),
(83, 30, 9, NULL, '2019-11-28 12:42:04', '2019-11-28 12:42:04'),
(84, 21, 3, NULL, '2019-11-29 07:56:06', '2019-11-29 07:56:06'),
(85, 22, 1, NULL, '2019-12-02 06:21:15', '2019-12-02 06:21:15'),
(86, 25, 4, NULL, '2019-12-02 13:05:33', '2019-12-02 13:05:33'),
(87, 20, 2, NULL, '2019-12-02 13:23:30', '2019-12-02 13:23:30'),
(88, 31, 5, NULL, '2019-12-03 07:27:53', '2019-12-03 07:27:53'),
(89, 31, 7, NULL, '2019-12-03 07:27:53', '2019-12-03 07:27:53'),
(90, 27, 5, NULL, '2019-12-03 09:20:44', '2019-12-03 09:20:44'),
(91, 32, 2, NULL, '2019-12-04 07:48:01', '2019-12-04 07:48:01'),
(92, 33, 9, NULL, '2019-12-04 13:06:09', '2019-12-04 13:06:09'),
(93, 26, 4, NULL, '2019-12-05 06:39:52', '2019-12-05 06:39:52'),
(94, 26, 2, NULL, '2019-12-05 09:56:53', '2019-12-05 09:56:53'),
(95, 34, 8, NULL, '2019-12-11 06:35:39', '2019-12-11 06:35:39'),
(96, 24, 4, NULL, '2019-12-12 10:24:07', '2019-12-12 10:24:07'),
(97, 13, 4, NULL, '2019-12-13 06:42:23', '2019-12-13 06:42:23'),
(98, 28, 4, NULL, '2019-12-19 10:25:29', '2019-12-19 10:25:29'),
(99, 35, 4, NULL, '2019-12-24 12:28:20', '2019-12-24 12:28:20'),
(100, 35, 1, NULL, '2019-12-26 05:47:53', '2019-12-26 05:47:53'),
(101, 28, 1, NULL, '2019-12-27 11:29:01', '2019-12-27 11:29:01'),
(102, 36, 2, NULL, '2020-01-07 06:34:07', '2020-01-07 06:34:07'),
(103, 32, 4, NULL, '2020-01-08 19:13:50', '2020-01-08 19:13:50'),
(104, 32, 6, NULL, '2020-01-13 07:25:45', '2020-01-13 07:25:45'),
(105, 37, 6, NULL, '2020-01-16 09:18:13', '2020-01-16 09:18:13'),
(106, 37, 4, NULL, '2020-01-16 09:18:43', '2020-01-16 09:18:43'),
(107, 4, 4, NULL, '2020-01-16 13:37:28', '2020-01-16 13:37:28'),
(108, 6, 7, NULL, '2020-01-17 05:51:33', '2020-01-17 05:51:33'),
(109, 35, 13, NULL, '2020-01-20 10:50:54', '2020-01-20 10:50:54'),
(110, 38, 7, NULL, '2020-01-22 11:32:51', '2020-01-22 11:32:51'),
(111, 38, 8, NULL, '2020-01-22 11:32:51', '2020-01-22 11:32:51'),
(112, 38, 9, NULL, '2020-01-22 11:32:51', '2020-01-22 11:32:51'),
(113, 39, 1, NULL, '2020-01-22 11:36:32', '2020-01-22 11:36:32'),
(114, 40, 1, NULL, '2020-01-22 15:04:08', '2020-01-22 15:04:08'),
(116, 40, 13, NULL, '2020-01-23 14:15:59', '2020-01-23 14:15:59'),
(117, 2, 13, NULL, '2020-01-23 14:17:00', '2020-01-23 14:17:00'),
(119, 42, 2, NULL, '2020-01-27 06:31:10', '2020-01-27 06:31:10'),
(120, 23, 4, NULL, '2020-01-27 08:08:56', '2020-01-27 08:08:56'),
(121, 43, 6, NULL, '2020-01-27 10:45:54', '2020-01-27 10:45:54'),
(122, 44, 6, NULL, '2020-01-29 05:58:26', '2020-01-29 05:58:26'),
(123, 41, 6, NULL, '2020-01-29 12:07:59', '2020-01-29 12:07:59'),
(124, 42, 4, NULL, '2020-01-29 12:17:18', '2020-01-29 12:17:18'),
(126, 45, 4, NULL, '2020-01-30 10:02:36', '2020-01-30 10:02:36');

-- --------------------------------------------------------

--
-- Table structure for table `roles`
--

CREATE TABLE `roles` (
  `id` int(10) UNSIGNED NOT NULL,
  `name` varchar(50) COLLATE utf8mb4_unicode_ci NOT NULL,
  `is_enabled` tinyint(1) NOT NULL DEFAULT '1',
  `created_at` timestamp NULL DEFAULT NULL,
  `updated_at` timestamp NULL DEFAULT NULL
) ENGINE=InnoDB DEFAULT CHARSET=utf8mb4 COLLATE=utf8mb4_unicode_ci;

-- --------------------------------------------------------

--
-- Table structure for table `stages`
--

CREATE TABLE `stages` (
  `id` int(11) NOT NULL,
  `potential_id` int(11) NOT NULL,
  `amount` varchar(255) NOT NULL,
  `description` text,
  `created_at` timestamp NOT NULL DEFAULT CURRENT_TIMESTAMP,
  `updated_at` timestamp NOT NULL DEFAULT CURRENT_TIMESTAMP ON UPDATE CURRENT_TIMESTAMP
) ENGINE=InnoDB DEFAULT CHARSET=latin1;

-- --------------------------------------------------------

--
-- Table structure for table `taskdacs`
--

CREATE TABLE `taskdacs` (
  `id` int(11) NOT NULL,
  `task_id` int(11) NOT NULL,
  `filename` varchar(255) NOT NULL,
  `updated_at` timestamp NOT NULL DEFAULT CURRENT_TIMESTAMP ON UPDATE CURRENT_TIMESTAMP,
  `created_at` timestamp NOT NULL DEFAULT CURRENT_TIMESTAMP
) ENGINE=InnoDB DEFAULT CHARSET=latin1;

--
-- Dumping data for table `taskdacs`
--

INSERT INTO `taskdacs` (`id`, `task_id`, `filename`, `updated_at`, `created_at`) VALUES
(1, 14, 'splash-screen.png', '2019-11-01 08:25:23', '2019-11-01 08:25:23'),
(2, 50, 'practice-areas.png', '2019-11-05 04:28:34', '2019-11-05 04:28:34'),
(3, 50, 'inner-pages.png', '2019-11-05 04:28:34', '2019-11-05 04:28:34'),
(4, 56, 'portfolio-content--2.png', '2019-11-05 13:17:25', '2019-11-05 13:17:25'),
(5, 124, 'our-blog.png', '2019-11-11 13:37:46', '2019-11-11 13:37:46');

-- --------------------------------------------------------

--
-- Table structure for table `tasks`
--

CREATE TABLE `tasks` (
  `id` int(11) NOT NULL,
  `project_id` int(11) NOT NULL,
  `user_id` int(11) NOT NULL,
  `comment` longtext,
  `hours` varchar(6) DEFAULT NULL,
  `updated_at` timestamp NOT NULL DEFAULT CURRENT_TIMESTAMP ON UPDATE CURRENT_TIMESTAMP,
  `created_at` timestamp NOT NULL DEFAULT CURRENT_TIMESTAMP
) ENGINE=InnoDB DEFAULT CHARSET=latin1;

--
-- Dumping data for table `tasks`
--

INSERT INTO `tasks` (`id`, `project_id`, `user_id`, `comment`, `hours`, `updated_at`, `created_at`) VALUES
(1, 1, 1, '<p></p><ol><li>testing</li></ol><p></p>', '01:00', '2019-11-05 10:39:20', '2019-10-29 12:21:36'),
(2, 2, 4, '<p></p><ul><li>test</li></ul><p></p>', '05:00', '2019-11-05 10:39:48', '2019-10-29 12:31:53'),
(3, 1, 1, '<p>testing</p>', '01:00', '2019-11-05 10:40:03', '2019-10-29 12:48:47'),
(4, 1, 1, '<p>how is the comment section coming up</p>', '01:00', '2019-11-05 10:40:15', '2019-10-29 12:49:38'),
(5, 1, 1, '<p>hello</p><p><br></p>', '09:00', '2019-11-05 10:40:34', '2019-10-29 12:54:48'),
(6, 1, 1, '<p>test</p>', '01:00', '2019-11-05 10:40:47', '2019-10-29 13:09:24'),
(7, 4, 6, '<p>Changes in API of leave group in Bhuumi Chat.</p><p>Leave Group API Implementation in Bhuumi Social</p>', '08:00', '2019-11-05 10:41:01', '2019-10-31 12:50:13'),
(8, 1, 1, NULL, '02:00', '2019-11-05 10:41:54', '2019-10-31 13:24:27'),
(9, 1, 1, '<p>grhr</p>', '01:00', '2019-11-05 10:49:25', '2019-10-31 13:24:53'),
(10, 3, 1, '<p>Today I worked on user profile&nbsp;</p>', '05:00', '2019-11-05 10:47:39', '2019-10-31 13:25:44'),
(11, 3, 1, '<p></p><ul><li>home page</li><li>contact page</li></ul><p></p>', '08:00', '2019-11-05 10:42:45', '2019-10-31 13:57:39'),
(12, 2, 3, '<p>@Avinash please describe your task</p>', NULL, '2019-11-01 05:57:00', '2019-11-01 05:57:00'),
(13, 10, 1, '<p></p><ul><li>Menu</li><li>Header</li><li>Footer</li><li>what we do</li></ul><p></p>', '03:00', '2019-11-05 10:46:27', '2019-11-01 08:20:25'),
(14, 5, 2, '<p>I have done Splash Screen or Launcher icon for android of <b><u>GoGo Menu.</u></b></p>', '01:00', '2019-11-05 10:49:25', '2019-11-01 08:25:23'),
(15, 8, 7, '<p>resolve bhuumi star issue of design after login</p>', '00:30', '2019-11-05 11:03:15', '2019-11-01 09:42:34'),
(16, 7, 7, '<p>change date format and changes in search queries all pages</p>', '02:30', '2019-11-05 11:04:13', '2019-11-01 09:44:19'),
(17, 14, 7, '<p>resolve issue of design after login if user login as general admin</p>', '00:30', '2019-11-05 11:03:39', '2019-11-01 09:45:39'),
(18, 13, 1, '<p></p><ul><li>paypal configuration R &amp; D</li><li>admin function R &amp; D</li></ul><p></p>', '02:00', '2019-11-05 10:45:19', '2019-11-01 11:56:23'),
(19, 2, 1, NULL, '03:00', '2019-11-05 10:46:27', '2019-11-01 11:56:40'),
(20, 14, 3, '<p>Local Setup ANd review code</p>', '04:00', '2019-11-05 10:47:06', '2019-11-01 13:05:53'),
(21, 15, 3, '<p></p><ol><li>working for project document</li><li>lead project manage</li></ol><p></p>', NULL, '2019-11-01 13:08:51', '2019-11-01 13:08:51'),
(22, 15, 3, '<p>\r\n\r\n</p><ol><li>working for project document</li><li>lead project manage</li></ol><p></p>', '04:00', '2019-11-05 10:47:06', '2019-11-01 13:09:34'),
(23, 4, 6, '<p>Worked on the message status icon and the changes in the edit group if no longer a member.</p>', '08:00', '2019-11-05 10:42:45', '2019-11-01 13:11:00'),
(24, 8, 5, '<p>chat design changes</p>', '01:00', '2019-11-05 10:49:25', '2019-11-01 13:11:32'),
(25, 3, 12, '<p>Anubhav please describe your work</p>', NULL, '2019-11-01 13:15:24', '2019-11-01 13:15:24'),
(26, 7, 7, '<p>check Bhuumi Ride billing isssue</p>', '00:30', '2019-11-05 10:58:03', '2019-11-01 13:20:52'),
(27, 4, 7, '<p>event accept decline, show profile page as front for solcial</p>', '04:00', '2019-11-05 10:47:06', '2019-11-01 13:22:45'),
(28, 8, 5, '<p>this is for the service page changes</p>', '00:15', '2019-11-05 10:53:14', '2019-11-01 14:05:36'),
(29, 2, 5, NULL, '00:30', '2019-11-05 10:53:54', '2019-11-01 14:15:44'),
(30, 10, 5, NULL, '06:15', '2019-11-05 10:55:49', '2019-11-01 14:19:58'),
(31, 5, 9, NULL, '03:00', '2019-11-05 10:46:27', '2019-11-01 14:30:39'),
(32, 5, 11, '<p>Compete All Discussed functionality.</p>', '03:00', '2019-11-05 10:46:27', '2019-11-04 09:01:02'),
(33, 10, 1, '<p><b>In NGO:-</b></p><p></p><ul><li><b></b>All home page<b></b><br></li><li>About page</li><li>Blog Page</li></ul><p></p>', '04:30', '2019-11-05 10:56:09', '2019-11-04 12:07:31'),
(34, 17, 1, '<p></p><ul><li>creat db and update db</li><li>upload folder</li></ul><p></p>', '01:30', '2019-11-05 10:56:27', '2019-11-04 12:19:32'),
(35, 2, 3, '<p></p><ul><li>Blog correction</li><li>nt found correction</li></ul><p></p>', '01:00', '2019-11-05 10:49:25', '2019-11-04 12:48:57'),
(36, 15, 3, '<p></p><ul><li>report for all user in admin</li><li>Report for user</li></ul><p></p>', '04:00', '2019-11-05 10:47:06', '2019-11-04 12:49:56'),
(37, 14, 3, '<p>work for mail module</p>', '03:00', '2019-11-05 10:46:27', '2019-11-04 12:50:42'),
(38, 3, 4, NULL, '08:00', '2019-11-05 10:42:45', '2019-11-04 13:06:57'),
(39, 17, 1, '<p></p><ul><li>Pdf download</li></ul><p></p>', '00:30', '2019-11-05 10:53:54', '2019-11-04 13:07:00'),
(40, 4, 6, '<p>Manage online, offline status and typing, stop typing.</p>', '08:00', '2019-11-05 10:42:45', '2019-11-04 13:10:21'),
(41, 4, 7, NULL, '08:00', '2019-11-05 10:42:45', '2019-11-04 13:13:13'),
(42, 9, 5, NULL, '00:15', '2019-11-05 10:54:23', '2019-11-04 13:26:40'),
(43, 3, 1, '<p></p><ul><li>blog</li><li>resolve design issue</li></ul><p></p>', '01:30', '2019-11-05 10:56:49', '2019-11-04 13:43:59'),
(44, 5, 9, NULL, '01:00', '2019-11-05 10:49:25', '2019-11-04 14:02:18'),
(45, 16, 5, NULL, '02:30', '2019-11-05 10:56:38', '2019-11-04 14:09:04'),
(46, 10, 5, NULL, '00:30', '2019-11-05 10:53:54', '2019-11-04 14:10:18'),
(47, 14, 5, NULL, '00:30', '2019-11-05 10:53:54', '2019-11-04 14:11:23'),
(48, 3, 5, NULL, '00:15', '2019-11-05 10:54:23', '2019-11-04 14:11:57'),
(49, 8, 5, '<p>bhuumi service page</p>', '04:00', '2019-11-05 10:47:06', '2019-11-04 14:12:27'),
(50, 3, 2, '<p>Make PSD of&nbsp; inner pages (Practice Areas)&nbsp;</p>', '04:00', '2019-11-05 10:47:06', '2019-11-05 04:28:34'),
(51, 2, 2, '<p>Make PSD of Portfolio Page.</p>', '04:00', '2019-11-05 10:47:06', '2019-11-05 04:29:49'),
(52, 5, 2, '<p>Make Launcher Icon&nbsp;</p>', '02:00', '2019-11-05 10:45:19', '2019-11-05 04:30:48'),
(55, 3, 4, NULL, '07:30', '2019-11-05 13:04:07', '2019-11-05 13:04:07'),
(56, 2, 2, '<p>Make PSD of Portfolio Page.</p>', '04:00', '2019-11-05 13:17:25', '2019-11-05 13:17:25'),
(57, 3, 1, '<p></p><ul><li>Blog Page load</li><li>meting with Vivek sir</li></ul><br><br><p></p>', '01:00', '2019-11-05 13:28:21', '2019-11-05 13:28:21'),
(58, 13, 1, '<p></p><ul><li>create a custom static page of upcoming events</li><li>dynamic upcoming events</li><li>book now</li></ul><p></p>', '05:00', '2019-11-05 13:30:12', '2019-11-05 13:30:12'),
(59, 13, 1, NULL, '01:00', '2019-11-05 13:31:30', '2019-11-05 13:31:30'),
(60, 17, 1, '<p></p><ul><li>install elementor editor</li><li>study about elementor editor</li><li>create a test page with editor</li></ul><p></p>', '02:00', '2019-11-05 13:33:21', '2019-11-05 13:33:21'),
(61, 6, 2, '<p>Make Icons&nbsp;</p>', '01:30', '2019-11-05 13:35:31', '2019-11-05 13:35:31'),
(62, 15, 3, 'admin report excel csv and view', '08:00', '2019-11-05 13:37:47', '2019-11-05 13:37:47'),
(63, 5, 9, NULL, '08:00', '2019-11-05 13:38:00', '2019-11-05 13:38:00'),
(64, 4, 7, NULL, '03:30', '2019-11-05 13:41:48', '2019-11-05 13:41:48'),
(65, 6, 8, '<p>1) Profile UI</p><p>2) Profile Details API</p><p>3) Profile Image uplaod</p><p>4) Profile Name change</p><p>5) User status UI</p><p>6) User status API</p><p>7) Testing and bug fixing</p>', '08:00', '2019-11-05 13:50:06', '2019-11-05 13:50:06'),
(66, 6, 10, '<p>Worked on fix the uploading and downloading issue and change the icons and font size for the chat screen.</p>', '08:00', '2019-11-05 13:56:53', '2019-11-05 13:56:53'),
(67, 8, 5, NULL, '00:15', '2019-11-05 14:14:58', '2019-11-05 14:14:58'),
(68, 8, 5, '<p>for bhuumi social</p>', '00:15', '2019-11-05 14:15:31', '2019-11-05 14:15:31'),
(69, 2, 5, NULL, '05:00', '2019-11-05 14:15:55', '2019-11-05 14:15:55'),
(70, 3, 5, NULL, '00:15', '2019-11-05 14:16:21', '2019-11-05 14:16:21'),
(71, 10, 5, NULL, '01:15', '2019-11-05 14:16:39', '2019-11-05 14:16:39'),
(72, 13, 5, NULL, '00:45', '2019-11-05 14:16:59', '2019-11-05 14:16:59'),
(73, 6, 6, '<p>Bug Fixes</p>', '06:00', '2019-11-06 04:24:45', '2019-11-05 04:18:26'),
(74, 2, 1, '<p></p><ul><li>blog section have show author name</li></ul><p></p>', '00:30', '2019-11-06 07:38:02', '2019-11-06 07:38:02'),
(76, 3, 4, NULL, '08:00', '2019-11-06 13:13:32', '2019-11-06 13:13:32'),
(77, 15, 3, '<p>\r\n\r\nWorking for project status\r\nand report hours\r\n\r\n<br></p>', '03:00', '2019-11-06 13:13:32', '2019-11-06 13:13:32'),
(78, 8, 7, '<p>change in bhuumi service page, matchmaking page, and show issue of admin alert message</p>', '05:30', '2019-11-06 13:17:10', '2019-11-06 13:17:10'),
(79, 4, 7, NULL, '01:30', '2019-11-06 13:18:23', '2019-11-06 13:18:23'),
(80, 18, 3, '<p>\r\n\r\n3 Form Add\r\n\r\n<br></p>', '03:00', '2019-11-06 13:20:21', '2019-11-06 13:20:21'),
(81, 8, 3, '<p>\r\n\r\nwork for form all\r\n\r\n<br></p>', '02:00', '2019-11-06 13:20:54', '2019-11-06 13:20:54'),
(82, 6, 6, '<p>Status Bug Fixes</p>', '08:00', '2019-11-06 13:21:03', '2019-11-06 13:21:03'),
(83, 13, 1, '<p></p><ul><li>show book now button</li><li>redirect to paypal with price</li></ul><p></p>', '02:00', '2019-11-06 13:34:39', '2019-11-06 13:34:39'),
(84, 7, 9, '<p>work on the client detail screen in the bhumi driver app and upload the app to the app store.</p><p>work on dashboard screen in case of the ride later and work on ride detail  screen and upload app to the app store </p>', '08:00', '2019-11-06 13:38:59', '2019-11-06 13:38:59'),
(85, 3, 1, '<p></p><ul><li>how we work at home page</li><li>mission statement page<br></li><li>vision statement page</li><li>Our story page</li><li>Our team page</li><li>Practice areas page</li></ul><p></p>', '05:30', '2019-11-06 13:41:31', '2019-11-06 13:41:31'),
(86, 6, 8, '1) Settings UI&nbsp;<div>2) Settings make functional</div><div>3) Group added action message</div><div>4) API changes update in app</div><div>5) Contact sync functional changes&nbsp;</div>', '08:00', '2019-11-06 13:57:20', '2019-11-06 13:57:20'),
(87, 6, 10, '<p>Worked on create the screen to pick the image from gallery and capture from camera.</p>', '08:00', '2019-11-06 14:08:10', '2019-11-06 14:08:10'),
(88, 3, 5, '<p>design bugs fixes</p>', '07:30', '2019-11-06 14:30:49', '2019-11-06 14:30:49'),
(89, 2, 5, NULL, '00:15', '2019-11-06 14:31:11', '2019-11-06 14:31:11'),
(90, 8, 5, NULL, '00:15', '2019-11-06 14:31:44', '2019-11-06 14:31:44'),
(92, 16, 5, '<p>internal pages HTML - about, contact and pizza pages</p>', '02:15', '2019-11-07 12:20:12', '2019-11-07 12:20:12'),
(93, 3, 5, '<p>about page design, animation and scroll effect and bug fixes</p>', '05:45', '2019-11-07 12:21:28', '2019-11-07 12:21:28'),
(94, 8, 3, '<p>Local setup and getting some error in my local</p>', '02:00', '2019-11-07 12:52:04', '2019-11-07 12:52:04'),
(95, 18, 3, '<p>\r\n\r\nAll form completed Resume form \r\nremainning in user panel\r\n\r\n<br></p>', '06:00', '2019-11-07 12:52:36', '2019-11-07 12:52:36'),
(96, 3, 4, NULL, '05:30', '2019-11-07 13:06:33', '2019-11-07 13:06:33'),
(97, 6, 6, '<p>Bug Fixes</p>', '05:00', '2019-11-07 13:09:32', '2019-11-07 13:09:32'),
(98, 4, 6, '<p>Add/Remove action message</p>', '03:00', '2019-11-07 13:10:29', '2019-11-07 13:10:29'),
(99, 8, 7, '<p>security check on website</p>', '07:30', '2019-11-07 13:13:21', '2019-11-07 13:13:21'),
(100, 3, 1, '<p></p><ul><li>blog page with inner page</li><li>event/reviews page(only not done after scrolling load data)</li></ul><p></p>', '08:00', '2019-11-07 13:27:51', '2019-11-07 13:27:51'),
(101, 6, 8, '<p>1) Group Action message control&nbsp;</p><p>2) Bug fixing</p>', '08:00', '2019-11-07 14:09:47', '2019-11-07 14:09:47'),
(102, 4, 5, '<p>icons on different pages with animation info animationetc</p>', '05:00', '2019-11-08 12:50:34', '2019-11-08 12:50:34'),
(103, 2, 5, '<p>star secutech portfolio page</p>', '01:00', '2019-11-08 12:51:20', '2019-11-08 12:51:20'),
(104, 18, 5, '<p>resume upload form bug fixes</p>', '02:00', '2019-11-08 12:56:14', '2019-11-08 12:56:14'),
(105, 8, 7, '<p>check user profile not update issue, check&nbsp; issue admin driver document not showing due to delete vehicle category,change social post page as main page and put hand logo icon on social , social page and event page, work on security check on website</p>', '08:00', '2019-11-08 13:18:01', '2019-11-08 12:59:33'),
(106, 18, 3, '<p>All Form done</p>', '04:00', '2019-11-08 13:04:04', '2019-11-08 13:04:04'),
(107, 3, 4, '<p>practices page changes completed.</p><p>Index page changes completed and Content updated.</p><p>New hiring page created</p><p><br></p><p><br></p>', '08:00', '2019-11-08 13:07:44', '2019-11-08 13:07:44'),
(108, 6, 2, '<p>Make icons for Bhuumi Chat.</p><p><br></p>', '03:00', '2019-11-08 13:11:30', '2019-11-08 13:11:30'),
(109, 15, 3, '<p>Correction in reports</p>', '04:00', '2019-11-08 13:12:40', '2019-11-08 13:12:40'),
(110, 2, 2, '<p>Make PSD for Blog Page.&nbsp;</p>', '01:30', '2019-11-08 13:13:19', '2019-11-08 13:13:19'),
(111, 4, 6, '<p>Assign Admin Action Message</p>', '01:00', '2019-11-08 13:21:41', '2019-11-08 13:21:41'),
(112, 6, 6, '<p><i>Bug Fixes</i></p>', '07:00', '2019-11-08 13:23:00', '2019-11-08 13:22:11'),
(113, 3, 2, '<p>Make Images .</p>', '01:00', '2019-11-08 13:27:51', '2019-11-08 13:27:51'),
(114, 4, 2, '<p>Make Icons&nbsp;</p>', '02:30', '2019-11-08 13:31:36', '2019-11-08 13:31:36'),
(115, 3, 1, '<p></p><ul><li>Page loading in blog page (Incomplete)</li></ul><p></p>', '04:00', '2019-11-08 13:53:16', '2019-11-08 13:53:16'),
(116, 16, 1, '<p></p><ul><li>Home Header</li><li>Home Footer</li><li>Home ABout</li><li>About Page</li><li>Home Contact</li><li>Contact Page&nbsp;</li></ul><p></p>', '04:00', '2019-11-08 13:54:46', '2019-11-08 13:54:46'),
(117, 6, 10, '<p>Worked on set the controls for the custom camera and set the new socket on method and emit for the unread message.</p>', '08:00', '2019-11-08 14:30:27', '2019-11-08 14:30:27'),
(118, 6, 8, '<p>1) Help UI and Webview with progress</p><p>2) Notification receiver user - set sender user name for all action type message like image,text,video, add user , remover user in group etc</p>', '08:00', '2019-11-08 14:36:12', '2019-11-08 14:36:12'),
(119, 4, 6, '<p>Action messages For Group</p>', '04:00', '2019-11-11 13:16:25', '2019-11-11 13:16:25'),
(120, 6, 6, '<p>Worked on ios issues</p>', '04:00', '2019-11-11 13:17:05', '2019-11-11 13:17:05'),
(121, 1, 1, '<p></p><ul><li>add a brand field in product</li><li>show product with vendor wise</li></ul><br><p></p>', '02:00', '2019-11-11 13:29:02', '2019-11-11 13:29:02'),
(122, 1, 1, '<p></p><ul><li>show product details</li></ul><p></p>', '00:30', '2019-11-11 13:29:56', '2019-11-11 13:29:56'),
(123, 3, 1, '<p></p><ul><li>after scrooling data show</li></ul><p></p>', '05:30', '2019-11-11 13:30:43', '2019-11-11 13:30:43'),
(124, 2, 2, '<p>Make PSD of OUR Blog Page</p>', '08:00', '2019-11-11 13:37:45', '2019-11-11 13:37:45'),
(125, 6, 8, '<p>1) Video recording&nbsp;</p><p>2) Video send</p><p>3) Group Action message for group image and group name update</p><p>4) Notification Group Action message for group images and group name update</p>', '08:00', '2019-11-11 14:02:24', '2019-11-11 14:02:24'),
(126, 4, 7, '<p>send mail to user while friend request, page share and invite friends</p>', '06:30', '2019-11-11 14:05:35', '2019-11-11 14:05:35'),
(127, 8, 7, '<p>deactive mobile social link</p>', '00:45', '2019-11-11 14:06:28', '2019-11-11 14:06:28'),
(128, 6, 10, '<p>Worked on video recording<br></p>', '08:00', '2019-11-11 14:48:29', '2019-11-11 14:48:29'),
(129, 3, 1, '<p></p><ul><li>Hiring page<br></li></ul><p></p>', '04:00', '2019-11-12 09:12:43', '2019-11-12 09:12:43'),
(130, 16, 1, '<p></p><ul><li>Our Pizza Page</li><li>Home Our Pizza</li><li>Newsletter</li></ul><p></p>', '03:00', '2019-11-12 12:57:54', '2019-11-12 12:57:54'),
(131, 2, 4, '<p>Portfolio page design</p>', '08:00', '2019-11-12 13:17:23', '2019-11-12 13:17:23'),
(132, 4, 6, '<p>Worked on action messages</p>', '02:00', '2019-11-12 13:17:46', '2019-11-12 13:17:46'),
(133, 6, 6, '<p>Bug Fixes</p>', '05:00', '2019-11-12 13:18:12', '2019-11-12 13:18:12'),
(134, 19, 4, '<p>last day submit button was not clickable.</p>', '05:00', '2019-11-12 13:19:28', '2019-11-12 13:19:28'),
(135, 4, 7, '<p>social change like show follow events, attend events to the users, from to date in event&nbsp;</p>', '07:00', '2019-11-12 13:26:02', '2019-11-12 13:26:02'),
(136, 21, 6, '<p>Bug Fixes in Dashboard API</p>', '01:00', '2019-11-12 13:26:56', '2019-11-12 13:26:56'),
(137, 20, 7, '<p>setup, procedure issue</p>', '01:00', '2019-11-12 13:28:43', '2019-11-12 13:28:43'),
(138, 2, 2, '<p>Make changes in PSD of Vipra Blog pages and Inner pages..</p>', '04:30', '2019-11-12 13:33:21', '2019-11-12 13:33:21'),
(139, 5, 2, '<p>Changes in the Splash Screen.</p>', '01:00', '2019-11-12 13:34:15', '2019-11-12 13:34:15'),
(140, 4, 2, '<p>Make Icons</p>', '01:00', '2019-11-12 13:38:31', '2019-11-12 13:38:31'),
(141, 6, 9, '<p>Xcode setup&nbsp; - 2 hrs</p><p>Design Setting and profile screen - 2 hrs</p><p><br></p><p><br></p>', '04:00', '2019-11-12 13:49:07', '2019-11-12 13:49:07'),
(142, 2, 1, '<p></p><ul><li>redirect 404 to the homepage(Not complete)</li></ul><p></p>', '01:00', '2019-11-12 13:58:02', '2019-11-12 13:58:02'),
(143, 6, 8, '<p>Whatsapp like folder create and mention for media(image,video,file etc) upload and download</p>', '06:00', '2019-11-12 14:36:14', '2019-11-12 14:36:14'),
(144, 20, 5, '<p>all pages design fixes</p>', '06:00', '2019-11-12 14:39:19', '2019-11-12 14:39:19'),
(145, 2, 1, '<p></p><ul><li>&nbsp;Redirect 404 to the homepage\r\n\r\n</li></ul><p></p>', '04:00', '2019-11-13 09:51:14', '2019-11-13 09:51:14'),
(146, 16, 1, '<p></p><ul><li>Chef list at home page</li><li>testimonial at home page</li></ul><p></p>', '01:00', '2019-11-13 09:53:05', '2019-11-13 09:53:05'),
(147, 1, 3, '<p>Add Multiple package and price in user panel and vendor panel with modification and update in vendor panel</p>', '04:30', '2019-11-13 10:51:02', '2019-11-13 10:49:55'),
(148, 6, 8, '<p>Whatsapp like folder create for image/file/video etc</p>', '06:00', '2019-11-13 11:51:48', '2019-11-13 11:51:48'),
(149, 15, 3, '<p>total hours in report for admin and excel and csv</p>', '01:30', '2019-11-13 12:11:44', '2019-11-13 12:11:44'),
(150, 13, 1, '<p></p><ul><li>\r\n\r\nshow book now button\r\n\r\n<br></li><li>show upcoming event</li><li>show past event</li></ul><p></p>', '02:00', '2019-11-13 12:36:50', '2019-11-13 12:36:50'),
(151, 4, 6, '<p>Worked on add/edit event date time validation.</p>', '05:00', '2019-11-13 13:13:04', '2019-11-13 13:13:04'),
(152, 8, 6, '<p>Star Bug Fixes and other rating issues</p>', '03:00', '2019-11-13 13:15:11', '2019-11-13 13:15:11'),
(153, 20, 7, '<p>make api comment, working on excel report</p>', '08:00', '2019-11-13 13:16:42', '2019-11-13 13:16:42'),
(154, 2, 4, '<p>Portfolio page has been completed.</p>', '08:00', '2019-11-13 13:19:38', '2019-11-13 13:19:38'),
(155, 2, 2, '<p>Make PSD of inner page of BLOG...</p>', '08:00', '2019-11-13 13:24:47', '2019-11-13 13:24:47'),
(156, 10, 1, '<p></p><ul><li>Work Page</li><li>contact Page</li></ul><p></p>', '01:00', '2019-11-13 13:59:54', '2019-11-13 13:59:54'),
(157, 22, 5, '<p>design changes on live website as mentioned on email&nbsp;</p>', '08:00', '2019-11-13 14:17:39', '2019-11-13 14:17:39'),
(158, 6, 10, '<p>Worked on create the screen to add the group participants.</p>', '08:00', '2019-11-13 14:29:49', '2019-11-13 14:29:49'),
(159, 8, 6, 'Worked on the login issue and reviewed the website for url changes.', '08:00', '2019-11-14 16:55:17', '2019-11-14 12:21:59'),
(160, 20, 7, '<p>driver comment api, change in driver comment api , make fare estimate api</p>', '04:00', '2019-11-14 13:08:11', '2019-11-14 12:59:38'),
(161, 20, 7, '<p>driver comment api, change in driver comment api , make fare estimate api</p>', '04:00', '2019-11-14 13:07:45', '2019-11-14 13:02:52'),
(162, 15, 3, '<p>\r\n\r\nWork for start and stop for a day\r\n in user\r\n\r\n<br></p>', '02:30', '2019-11-14 13:05:17', '2019-11-14 13:05:17'),
(163, 3, 1, '<p></p><ul><li>Our Team issue resolved</li><li>Content Updated</li></ul><p></p>', '03:00', '2019-11-14 14:02:59', '2019-11-14 13:05:52'),
(164, 23, 3, '<p>\r\n\r\nHelp anubhav for ci\r\nproject discussion with \r\nSoumdeeep Sir\r\n\r\n<br></p>', '02:30', '2019-11-14 13:06:11', '2019-11-14 13:06:11'),
(165, 14, 3, '<p>email</p>', '01:00', '2019-11-14 13:06:29', '2019-11-14 13:06:29'),
(166, 23, 1, '<p></p><ul><li>leonsistema.picsausg.com<br></li></ul><p></p>', '05:00', '2019-11-14 13:09:12', '2019-11-14 13:09:12'),
(167, 2, 2, '<p>Make about us page ...</p>', '06:00', '2019-11-14 13:16:15', '2019-11-14 13:16:15'),
(168, 6, 8, '<p>1) Whatsapp like folder mange</p><p>2) Duplicate video sharing bug fix</p><p>3) Duplicate image sharing bug fix</p><p>4) Conversation list search</p>', '04:00', '2019-11-14 14:23:16', '2019-11-14 14:23:16'),
(169, 20, 8, '<p>Comment listing UI</p>', '04:00', '2019-11-14 14:24:03', '2019-11-14 14:24:03'),
(170, 6, 10, '<p>Worked on create the screen to add participant and group creation<br></p>', '08:00', '2019-11-14 14:29:54', '2019-11-14 14:29:54'),
(171, 7, 7, '<p>Check Bhumi ride issue</p>', '01:00', '2019-11-14 14:45:12', '2019-11-14 14:42:44'),
(172, 8, 6, '<p>Fixed issues in star/forum edit/delete icon and show send message box on matchmaking page before login.</p>', '03:00', '2019-11-15 13:01:12', '2019-11-15 13:01:12'),
(173, 20, 8, '<p>Api integration and commenting&nbsp;</p>', '08:00', '2019-11-15 13:04:12', '2019-11-15 13:04:12'),
(174, 20, 7, '<p>change and test in multi fare estmate time, change and test in end trip api&nbsp;</p>', '08:00', '2019-11-15 13:05:32', '2019-11-15 13:05:32'),
(175, 2, 2, '<p>Make PSD of Landing page of Portfolio.</p>', '06:30', '2019-11-15 13:22:25', '2019-11-15 13:22:25'),
(176, 3, 1, '<p></p><ul><li>content update</li></ul><p></p>', '01:30', '2019-11-15 13:30:23', '2019-11-15 13:28:44'),
(177, 1, 1, '<p></p><ul><li>resolved issue</li></ul><p></p>', '06:30', '2019-11-15 13:29:53', '2019-11-15 13:29:53'),
(178, 6, 10, '<p>Worked on call the create group api and add the group member in the group member table.<br></p>', '08:00', '2019-11-15 13:49:26', '2019-11-15 13:49:26'),
(179, 3, 5, '<p>Design bug fixes</p>', '03:45', '2019-11-15 14:16:35', '2019-11-15 14:16:35'),
(180, 22, 5, '<p>design changes as per email</p>', '01:45', '2019-11-15 14:17:38', '2019-11-15 14:17:38'),
(181, 2, 5, '<p>Meeting and blog page&nbsp;</p>', '01:30', '2019-11-15 14:18:25', '2019-11-15 14:18:25'),
(182, 4, 5, '<p>icon changes and other design changes as per sushant</p>', '01:00', '2019-11-15 14:21:05', '2019-11-15 14:21:05'),
(183, 25, 1, '<p></p><ul><li>login</li></ul><p></p>', '02:00', '2019-11-18 07:27:29', '2019-11-18 07:27:29'),
(184, 2, 4, '<p>Blog page has been completed.</p>', '07:30', '2019-11-18 12:56:07', '2019-11-18 12:56:07'),
(185, 1, 1, '<p></p><ul><li>location</li></ul><p></p>', '06:00', '2019-11-18 13:03:02', '2019-11-18 13:03:02'),
(186, 20, 11, '<p>Work on Background location update.</p>', '08:00', '2019-11-18 13:25:40', '2019-11-18 13:25:40'),
(187, 4, 6, '<p>Bug fixes and chat</p>', '08:00', '2019-11-18 13:29:04', '2019-11-18 13:27:02'),
(188, 20, 7, '<p>Admin driver excel</p>', '06:00', '2019-11-19 04:29:17', '2019-11-18 13:29:11'),
(189, 6, 10, '<p>Worked on create the group and add in a list and display on chat detail screen.<br></p>', '04:00', '2019-11-18 13:44:41', '2019-11-18 13:44:41'),
(190, 8, 7, '<p>check junk mail issue, discuss bhummi social points</p>', '01:30', '2019-11-19 04:38:30', '2019-11-18 04:31:47'),
(191, 23, 1, '<p></p><ul><li>project setup in Avinash\'s system&nbsp;</li></ul><p></p>', '01:00', '2019-11-19 07:39:27', '2019-11-19 07:37:58'),
(192, 20, 7, '<p>make update driver lat long api, make driver comment page in admin panel ride wise and put link to view comment</p>', '06:00', '2019-11-19 11:04:45', '2019-11-19 11:04:45'),
(193, 14, 3, '<p>Mail functionality\r\n\r\n<br></p>', '02:00', '2019-11-19 13:07:32', '2019-11-19 13:07:32'),
(194, 23, 3, '<p>working in&nbsp;\r\n\r\n<a target=\"_blank\" rel=\"nofollow\" href=\"http://leonsistema.picsausg.com/\">http://leonsistema.picsausg.com/</a>\r\n\r\n</p>', '06:00', '2019-11-19 13:13:22', '2019-11-19 13:13:22'),
(195, 1, 4, '<p>packages page changes are completed.</p>', '00:30', '2019-11-19 13:23:25', '2019-11-19 13:23:25'),
(196, 2, 2, '<p>Edit PSD of Portfolio Page..</p>', '03:00', '2019-11-19 13:25:16', '2019-11-19 13:25:16'),
(197, 8, 4, '<p>Bhuumi under three point are completed.</p>', '00:45', '2019-11-19 13:25:50', '2019-11-19 13:25:50'),
